标题,状态,领域,用户名,时间,内容,回复单位,回复内容,回复时间
公司辞退员工不按照劳动法补偿,待回复,就业 求助,W***,2019-10-3008:58,领导好！我要求助！我是上海优医家健康管理咨询有限公司员工，公司因经营原因，单方面要与我解除劳动合同，劳动合同并没有到期。1.公司以负债为由，让我签辞职申请表！违背事实！还无视劳动法规定，不按劳动法进行补偿。我在公司工作1年零几个月，公司没有提前一个月通知让我离职，本应该补偿(1.5+1)个月，共2.5个月工资，但公司发给我的赔偿协议上，只写赔偿1个月工资。2.公司从10月初开始，不提供我们工作，让我们在家等通知，直到月底才通知我，要辞退我，在家等公司通知这段时间的工资，公司不想按照劳动法规定发给我！另因我是在外地，无法跑到上海去维护我作为劳动者的权益，所以公司才明目张胆的无视法律，无视劳动法！法律面前，人人平等！恳请领导帮助，希望能给我们劳动者做主，帮助我们拿到劳动法规定的经济补偿金！非常感谢！,,,
讨薪,待回复,医疗 投诉,啊***,2019-10-2116:32,尊敬的鲍书记您好：       我是上海红枫国际妇儿医院的原职工，我于2017年11月份离职，红枫欠我2017年10份工资，以及2016及2017年年休假折算工资9000元，至今未支付。恳请尊敬的鲍书记为我们主持公道，讨回工资。      谢谢!,,,
强烈谴责徐汇牙病防治所的没有医德的医生,待回复,医疗 投诉,小***,2019-10-1909:45,徐汇牙病防治所口腔外科名叫孙琦的女医生没有医德并且脾气相当暴躁。对我怒言相对之外，治疗期间，没有问我任何关于牙齿，关于是否过敏，是否有病史的相关问题，就凭个人想法在我的病历单上写了与病人沟通，病人拒绝治疗的话语。我苦苦等待了八个小时的医生居然没有给我任何的治疗方案，虽说牙病不是病，但是痛起来也是可以要人命的。希望有关部门，可以督促牙防所的相关医务人员，毕竟投诉他们的也不是我一个人。医患矛盾太大，会导致很多问题，希望可以督促该牙防所的相关没有医德的医护人员，感谢！,,,
红枫妇儿医院拖欠工资,待回复,就业 投诉,小***,2019-10-1811:07,尊敬的鲍书记您好：       我是上海红枫国际妇儿医院的原职工，2017年11月份离职，红枫欠我2017年10份工资，以及2017年年休假折算工资99981.69元，至今未支付。恳请尊敬的鲍书记为我们主持公道，讨回工资。                                            谢谢。,,,
美丽家园项目维修加固屋顶，导致家中漏水，求助,待回复,城建 求助,金***,2019-10-1421:16,梅陇十一村维修加固屋顶防水时正好遇到台风天，导致我家49号-已售，31号-新买，2处6楼的房屋漏水，墙面起泡开裂，其中31号为新装修，9月底刚完成粉刷。居委表示施工队不愿出面解决，居委也没办法，请求相关部门给个说法。,,,
乱扣保证金,待回复,企业 投诉,老***,2019-10-1414:40,上海恒奢商贸有限公司经营佳茵这个产品，当时购买他们佳茵后需缴纳1500元保证金，之后乱扣除保证金，在没有提供证据的情况下，扣除1500，与该公司所谓稽核部门沟通后，不给提供证据，一直说他们查到我们低价所以扣除保证金，我要求他们提供证据，他们又各种理由不给提供，请领导重视予以处理，实在没办法才在这里求助，麻烦领导了,,,
小区业主大会通过地面固定车位有车辆长期占我位,待回复,城建 求助,祝***,2019-09-2711:25,您好 我这是老式小区无地下车位 之前非机动车抢占车位验证经12345投诉之后 改进停车方式 业主大会通过地面固定车位 先经过了一个月的车辆登记之后给予登记的业主固定车位 现有一辆无车位车辆长期占用我车位物业却一直没有解决 让物业给我反馈也无消息 一、我想求助一下 经过业主大会觉得的固定车位是否有法律效应 如物业无法解决能否拨打110将他车辆拖走 二、希望有关部门能对我小区物业进行督促 工作效率十分低下（甚至我怀疑根本没人去解决 因为我晚上回来给物业打电话都是说知道了我帮你登记 约定第二天反馈给我解决方案也无反馈） 谢谢！！！,,,
小区到底有没有人管，电梯坏，绿化随意占用,待回复,城建 投诉,l***,2019-09-0715:16,宋园路138弄小区处于无人管的状态，请区领导予以关注，协调解决。违章建筑无人管，有悖国家要求，造成全小区都批不出产证，于是没有维修基金，多年无人管，老百姓利益不重要？！分到顶楼违建的领导利益重要？！现小区处于恶性循环，电梯关人，坏了无人维修，到处漏水。看看下图，不知又是哪个领导家的车，物业不敢管，管了也没反应，诸如此类太多了。,,,
看病难住院难,待回复,医疗 求助,拜***,2019-08-1716:05,您好！我是安徽省蚌埠市固镇县的人。今年9月初在家里县医院带我弟检查身体。情况不好怀疑是肾肿瘤。建议去上海或者北京大医院。家里人就带我弟到上海复旦大学附属肿瘤医院。8月12号周一挂的专家门诊，医生也没说什么，就开了一大堆检查单子。花了两天时间把所有检查做完，医生却不上班。后来又从新挂一个医生的门诊，把检查单子给他看，他说是恶性的要手术摘肾。可是现在都8月17号了今天又是周六，还要等下个星期。我也不知道该向谁反应这个看病难住院难的问题。我相信不止我一个人这么着急，毕竟这是人命关天的事，这一天天不住院，身上带个定时炸弹，弟弟才15周岁，还那么小。实在是等的太急人了。即使帮不上我们也没事，我还是想反应这个事，希望领导能看到，解决问题，让后期看病的人不那么着急担心，浪费时间和金钱精力。,,,
中心小区环境无人管理12345反映多年无果,待回复,环保 投诉,y***,2019-07-2814:52,上海市徐汇区肇嘉浜路669弄小区共几百户人家，环境多年无人管理，建筑垃圾，生活垃圾随意摆放，在2号门口堆放的甚至破坏绿化带。近日上海市实行垃圾分类，此小区依旧垃圾桶干湿不分至今无人监管。小区无门卫保安，外来车辆可以随便进出小区，可能是市中心唯一免费停车点，甚至随意停在2号狭窄楼道口，有时连老人婴儿推车都无法进出，阻碍抢救通道，给小区安全带来极大隐患。由于无人监管12345反映多年指标不治本，物业、居委相互推诿，以此小区历史遗留问题，无一体化为由，无法管理。希望小区能够有统一监管部门，配置保安门卫，给居民提供安全良好环境,,,
举报南丹东路合杆整治工程夜间2、3点噪声扰民,待回复,环保 投诉,m***,2019-07-0716:07,南丹东路靠近天钥桥路，已经连续两周每天晚上2-3点依旧能听到持续一整晚的电镐等高噪声扰民。导致居民无法休息无法正常生活。根据《上海市建设工程夜间施工许可和备案审查管理办法》第六条(四）禁止使用高噪声机械或设备。希望能得到尽快解决，谢谢。,,,
急！急！急！寻物!,待回复,城建 求助,放***,2019-07-0113:34,尊敬的鲍炳章书记，您好！本人于今年1月24日上午10：40左右，在从上海市精神卫生中心到体育场地铁站的路上，或是地铁上遗失一个黑色塑料手提袋，手提袋内有本人病历、医药发票和存折等重要物品！不知是否有好心人捡到上交给当地派出所或地铁站，恳求帮助，千恩万谢！本人已于当天乘坐火车赶回老家阜阳。,,,
漕河泾派出所领取户口卡艰难,待回复,政务 求助,Z***,2019-06-2814:14,2018年5月1日已出台政策，领取户口卡只需要实有人口登记即可，徐汇区其他派出所也不需要租赁备案，可漕河泾派出所却需要租赁备案。这给大家办理户口卡带来很大的困难。房东不配合，且需要多次请假去办理，非常影响日常工作。既然出台了政策，为什么现在不同区域还差别待遇呢？,,,
扰民建筑垃圾迟迟未清,待回复,城建 求助,W***,2019-06-0518:12,长乐路637弄15号门口建筑垃圾堆放了近2个星期无人清理，近期天气转热，容易滋生蚊虫，曾向物业反应无果，请求核实处置,,,
东安二村小区开棋牌室，严重干扰老人小孩。,待回复,治安 投诉,淡***,2019-05-2708:38,尊敬的鲍炳章书记：    您好！    我是东安二村 28 号楼原居住民，在此投诉举报我栋二楼 204 室，在居民区内私自开设棋牌室，共计摆放三张麻将桌，每天都有不同的人来打麻将。    每日赌博时间集中于12:00—18:00，甚至有时周末的19:00—24:00。    该棋牌室实属违法聚众赌博，麻将声、大吵大闹声、桌椅拖动声等极其极其嘈杂。东安二村本属于老小区，房屋结构本来就比较单薄，隔音又不好，居然还开立在楼体中部，本栋居民苦不堪言已多时，导致现在本楼的老人每日怨声载道，小朋友都没有一个良好的在家的学习氛围，周末休息的上班族也不能好好休憩，甚至有时楼下的防盗门都不能正常关闭，导致邻居交通工具丢失。曾有邻居拨打110投诉举报过，但该棋牌室老板只是连连敷衍，警方和物业沟通均无果，称其本地人，能奈他几何？影响极其极其恶劣。    在此恳请有关部门关注并解决，还居民美好安定生活，谢谢！,,,
百家宜莱博顿淋浴房蛮横无理,待回复,企业 投诉,b***,2019-05-0217:52,书记您好！我们在装修期间在徐汇区瑞金南路百家宜下单了一个淋浴间，销售没有做到信息告知义务，隐瞒消费者情况，完全误导我们下单了一个我们不想要的淋浴间，还是我们自己过去看才发现的，但是他们以已经制作为由拒绝撤单，甚至都没有走到安装这步。我们深感欺骗，求告无门，实在绝望，还请书记百忙之中处理，非常感谢！,,,
希相关部门严厉打击网络主播假慈善 蹭热度 炒作,待回复,文娱 投诉,卧***,2019-03-2911:05,3月20日左右上海某区沈X走红网络直播平台（抖音 快手）过后，全国各地的主播网民齐聚上海，去和他拍视频，做直播，在抖音平台网友拍摄的视频里，沈X说了他没有授权任何人开直播拍视频。这些主播和网名的行为已经侵犯别人的肖像权了，因为他们拍视频和做直播都是为了营利。这些主播和网民影响沈X本人的生活及周边居民的生活，一个宽容、自由的社会，是应该尊重沈X先生流浪与言论的自由，但愿我们的社会不是如此娱乐化，如此地堕落！应该说知识分子的堕落，是一个社会和一个民族彻底的和最后的堕落近日发现抖音直播平台一主播坐拥50+万粉丝，天天上传视频卖书，声称将书本卖出的钱全部拿出去做公益，视频上传至抖音直播平台，借此吸引粉丝关注“送礼物”实现获利目的。她的做法是否符合慈善法的规定，是否违规违法，是否违反社会公德，是否损害社会公共利益，希望相关部门加强监管力度。她利用抖音平台开展慈善活动，平台有没有监督她做公益，希望不要在发生类似四川省凉山州假慈善事件，扭曲了慈善的真正价值！,,,
斜土路双峰北路工地扬尘污染,待回复,环保 投诉,Z***,2019-03-1310:43,您好，想向您反映徐汇区斜土路双峰北路一工地的严重空气污染问题。该空气没有任何环保措施，工地造成的扬尘影响了周围一大片居民的正常生活。六点多小区里的灰尘跟大雾一般。没有污染的天气，房间窗门紧密的情况下屋内PM2.5还是高达150左右。希望区政府可以加以重视，非常感谢！,,,
市区居民养鸽困扰邻居,待回复,城建 投诉,小***,2019-03-1016:19,书记您好，龙华西路81弄35号501住户长期养鸽，严重影响邻居，阳台窗户从来不敢开，都是鸽子屎鸽子毛，夜里睡觉都听到鸽子叫,,,
上海某金融公司现金贷业务、暴力催收、利息畸高,待回复,金融 求助,给***,2019-01-2910:16,本人于2016年2月申请上海麦子金服旗下诺诺镑客金融服务有限公司的一款现金贷产品（名校贷），借款30000，实际下款24000，每月还款1130.33元。还款期间发生逾期，平台对本人身边朋友、同事进行无数次电话骚扰，甚至是侮辱。谩骂、人身攻击，对我的工作和生活造成非常大的影响，现请领导协助解决。,,,
违章建筑房何时才能拆除,待回复,城建 投诉,y***,2019-01-2516:36,徐汇区委书记鲍炳章，你好：    反映徐汇区华山路855号复兴西路华山路口老建筑旁有个无证的违章搭建“玻璃房”，这违法建筑不仅占据了公共部位，而且更妨碍了优秀历史建筑的修缮，还严重影响徐汇区全国文明镇的形象。希望有关执法部门按照“五违四必“精神，对影响城市形象的这处违规“玻璃房”依法予以拆除整治，让城市市容秩序更加规范，城市环境更加整齐，切实提升徐汇区城区形象。,,,
无良享骑扣留押金无法退还，投诉失败,待回复,金融 求助,L***,2019-01-2408:11,"书记您好：  我于2018年12月申请退换享骑押金，原因是市区大多数地方无法使用，造成不便。  账号原有的118余额无法退还，但299元诚信金缺被无良商家扣留，答应的7-15天退还。但一个多月仍渺无音讯。电话客服没人接，app里的客服更是没人回。寻找享骑微信公众号内的客服也没有人回应。  曾在微信公众号多次登记，均无回应。  望上级领导看到，能帮我投诉他们，成功退还押金，谢谢！",,,
违法建筑房何时才能拆除,待回复,城建 投诉,y***,2018-12-2108:31, 徐汇区委书记鲍炳章，你好：反映徐汇区华山路855号复兴西路华山路口老建筑旁违章搭建“玻璃房”，这违法建筑不仅占据了公共部位，而且还严重影响徐汇区全国文明镇的形象。希望有关执法部门按照“五违四必“精神，对影响城市形象的这处违规“玻璃房”依法予以拆除整治，让城市市容秩序更加规范，城市环境更加整齐，切实提升徐汇区城区形象。,,,
户籍证明开不出,待回复,政务 求助,W***,2018-11-3011:16,我是吴xx，我是挂在徐家汇派出所的公共户口，因为租不起徐家汇的房子，所以派出所就以我在徐家汇没有租房备案登记不给开户籍证明，我怎么办,,,
享骑电动车退押金,待回复,金融 投诉,j***,2018-11-2916:49,我于11月2号注册的享骑电动车。并交299元押金。用了一次车。我们公司楼下没有停车点，很不方便。我就当天申请退还押金。它们上面写着押金退还需要7到15个工作日。可是这都快一个月了押金还没退回来。,,,
车辆停放在高压线下存在安全隐患，请予以取缔。,待回复,城建 投诉,贺***,2018-11-2310:01,政府、电力公司领导：上海市徐汇区属漕河泾开发区管理的虹许路58号（包含桂果路700号）其停车场设置在220KV高压线下。此停车场无消防设施，无安全评估，无营业许可证，无专业人管理。其停放的车辆里有大量汽油，车辆相互挨的比较近。车辆停放在高压线下存在安全隐患，请予以取缔。,,,
诉求：关闭停车场、拆除彩钢房,待回复,城建 投诉,贺***,2018-11-2009:05,诉求：关闭停车场、拆除彩钢房事发时间：从2016年----到2018年11月10日事发地址：上海市徐汇区虹许路58号（包含桂果路700号）诉求内容：1、上海市徐汇区虹许路58号（包含桂果路700号），系高压220KV线路（铁塔）下方拆除“五违”后遗留下的空地，现用于各种汽车销售公司停放4S店车辆、搭建彩钢房用于修理、试验、经营。2、现请求关闭停车场、拆除彩钢房。追究同意将上述空地出租的相关责任人的责任。事实：上述空地无正规合法用地手续，没有停车场运营许可证，没有得到供电局、高压线路管理部门同意，擅自违规操作；理由如下：1、此空地因车辆大量囤积，无正常车辆进出通道，现在车辆里有大量汽油，发生火灾，无法及时撤离。2、搭建的彩钢房无固定基础，夹心为易燃材料，遭遇火灾，大风无法预料后果。3、停车场新的车辆都是大板车运输，并都是半夜进出，嘈音惊小孩嘈老人，无法入眠。4、4S店每天在停车场试车发出轰鸣刺耳声音。白天都不让人安身。5、4S店每天在停车场试车、维修车辆汽油味特重，让人提心吊胆。6、此空地无合格消防设施、无土地使用证、无停车场运营许可证。相关法律法规：1、《电力设施保护条例》 第四条：电力企业必须加强对电力设施的保护工作。对危害电力设施安全的行为，电力企业有权制止并可以劝其改正、责其恢复原状、强行排除妨害，责令赔偿损失、请求有关行政主管部门和司法机关处理，以及采取法律、法规或政府授权的其他必要手段。第十五条：任何单位或个人在架空电力线路保护区内不得兴建建筑物、构筑物。　2、《国土资源执法监督规定》：1、公民有权依照法定程序对违法使用土地的情况进行监督，并对违反土地资源法律法规的行为进行制止和进行监督， 监督有关部门行政执法活动。让有关部门工作人员应当具备政治素质，忠于职守、秉公执法、清正廉明，不得超越法定职权。2、主管部门对执法部门进行监督，执法检查；制止违法用地行为；请求：根据 《电力设施保护条例》《国土资源执法监督规定》法律规定、关闭停车库、拆除彩钢房,,,
寓见公寓拖欠员工工资,待回复,企业 求助,W***,2018-11-1209:31,上海寓见科技是租房行业，2018年8月份资金链已出现问题，仍然继续大量招工，导致9月份和10月份员工薪资发不出来。多次违背承诺，希望相关部门能够帮助我们要回属于我们的工资。谢谢。,,,
被寓见公寓小额贷，无房可住，还要被迫承担债务,待回复,企业 求助,从***,2018-10-1711:23,书记您好：本人2017.11入住寓见公寓，2018.9.6因康桥镇秀龙居委会贴出告知，告知原因为隔断，租客过多，必须退租，无奈9.9搬家。搬出后半月，公寓管家承诺月底退掉所有押金租金，月底之后电话无法接通，国庆节后联系管家，让到寓见总部，无奈，皮球被踢到了总部，满屋都是被小额贷困着的租客，我们也还有7个月到期。不仅租金押金未退，还有被贷的7个月房租。现在管家联系不上，总部只有几个小职员，诺大的办公室已人去楼空，解释原因是和青客进行过度，以便进行清算。报警，来了一趟又一趟，也未解决，踢皮球目前我的诉求是：1.小额贷（晋商消费金融）还有7个月，每月1080，共计7560，请求解约，不要影响个人征信2.退两个月押金及一个月房租3900恳请领导予以重视，谢谢,,,
上海源邮科技拖欠工资,待回复,就业 求助,吖***,2018-09-2713:58,"上海源邮科技拖欠工资, 一旦有员工提交辞职, 就停止发放员工工资,已经有很多离职的员工没有拿到应得的工资了,望书记前来侦查, 书记可以在天眼查上查一下这家企业,已经上征信啦, 书记也可以来源邮科技了解一下情况, 在职的员工还有7月份工资没发的, 8月份的工资也是到现在还没有发, 望书记前来侦查",,,
户外广告牌存在安全隐患,待回复,城建 投诉,y***,2018-09-0219:56,徐汇区委书记鲍炳章，你好：    反映徐汇区吴中路100号、118号楼顶各有一处违规户外广告（广告内容为锦江汽车服务中心、嘉州汽车、锦江汽车等）。多处大型户外广告设置年限已久，四周都是交通要道，如大风一刮非常的危险，市民对这个巨大的公共安全隐患防不胜防，就像一颗颗炸弹时刻威胁着市民的生命和财产安全，存在严重的安全隐患。近期黄浦区南京东路132号一商店店招脱落，砸中9人，这一血的教训，应引起有关部门领导的高度重视。上海市人民政府办公厅今天发出《关于全面开展空中坠物安全隐患专项检查的通知》，要求各区政府、市政府各委办局及各有关单位加强针对空中坠物安全隐患的专项检查，着力消除隐患，不断强化城市精细化管理，确保城市运行安全。希望徐汇区政府根据本市户外广告专项整治方案要求，在国际博览会前，对影响城市形象的多处违规楼顶户外广告依法予以拆除，保障行人的安全，切实提升徐汇区区城区形象。,,,
拆除违规楼顶多处违规危险户外广告,待回复,城建 投诉,y***,2018-08-2413:18,徐汇区委书记鲍炳章，你好：     反映上海市徐汇区吴中路6号、16号、100号、118号四处楼顶违规危险户外广告。这多处大型户外广告设置年限已久，四周都是交通要道人流量大，大风一刮非常的危险，市民对这个巨大的公共安全隐患防不胜防，存在严重的安全隐患。      近期黄浦区南京东路132号一商店店招脱落，砸中9人，这一血的教训，应引起有关部门领导的高度重视。      希望徐汇区政府根据本市户外广告专项整治方案要求，在国际博览会前，对影响城市形象的多处违法楼顶户外广告依法予以拆除，保障行人的安全，切实提升徐汇区城区形象。,,,
贝米钱包p2p,待回复,金融 求助,W***,2018-08-1614:20,贝米钱包自2018年7月13日宣布良性退出以来至今已有一月有余，此次事件涉及受害群众54000人，我们正常的投资到期无法提现，孩子学费，老人养老，房贷等等急需用钱的地方没有来源，生活一下子被逼入了绝境，恳请鲍书记关注此事，尽快督促上海徐汇经侦办启动兑付方案，救万民于水火之中。万分感谢！,,,
企业违建何时拆？,待回复,城建 投诉,柳***,2018-07-2011:01,巩固“五违四必”成果，严格落实“六必拆”。徐汇区田林街道柳州路长春小区旁边弄内，企业违法搭建严重，侵占公共部位，希望鲍书记能不讲情面，依法查处。,,,
上海,待回复,其他 求助,邬***,2018-07-0415:33,鲍书记您好，我想反映下关于您区上海鸿祥电子商务有限公司骗取本人装修款事宜，本人于2017年7月委托品牌我爱我家（公司名称上海鸿祥电子商务有限公司）装修一套房子，水电完工后就将尾款全部结清前后共计11万多，但是在尾款付完后他们就开始停工，我去他们公司好多次也，每次都在敷衍我，后来我也报过警，在警官的调解下我再次相信他们，可就在今年5月份他们突然人去楼空，对我们没有任何通知和交代，后来我才知道全国有很多和我类似的受害者，他们组织去政府去公司维权，我最后还是没去，因为我从小从上海长大，我相信上海政府会给我们老百姓做主的。,,,
关于上海的交通,待回复,交通 咨询,L***,2017-07-0215:22,尊敬的领导：您好，我是上海普通市民，我代表正在拍上海私车牌照广大市民咨询求助:上海何时才能改善一块铁皮牌照能卖10来万的问题，全国那么多大中小城市，唯有上海想拿到一张本地牌照真是难上加难，你挂个外地的牌照吧，又限时段路段，很多路又不能走。我们每天要面对的就是出行难，何时能放宽或者改善目前这种困境，让本市居民真正得到实惠？,,,
