标题,状态,领域,用户名,时间,内容,回复单位,回复内容,回复时间
徐汇区梧桐絮扰民,待回复,环保 求助,匿***,2017-05-1111:01,徐汇区华山路以东，瑞金路以西，淮海中路以南，肇嘉浜路以北这块区域内的梧桐树是徐汇区的一道风景，但近两年来梧桐絮在每年四月飘飞，居民步行骑车即便佩戴口罩，呼吸道还是会因极其细小的飞絮飞入而感觉咽喉不适出现呼吸道过敏等一系列健康问题，有时甚至眼睛也会被飞入飞絮，生活上出行上造成极大困扰。作为一位生活在该地区四十多年的市民来说，过去几十年里，梧桐絮其实从未对我的生活造成困扰，这些困扰是近几年出现的。记得以前在春季即将来临之时，园林部门会对梧桐树枝进行修剪，而修剪中有一道重要工序就是人工将造成梧桐飞絮的梧桐果子给剪掉，此时由于天气还没有转暖，因此果子不会迸裂造成飞絮四散，完整的果子会掉落在人行道上，小孩子拿起来当玩具玩也不会飞散。但近几年不知道是何原因，这个工序被简化甚至消失了，也有人说是园林部门人手不够的关系，无论如何，对梧桐飞絮束手无策是现状。梧桐树作为这一区域的风景不仅仅出现在照片视频中添加城市美感，它更是与市民生活息息相关的可以被呼吸和感受的，假如只要求它漂亮而不考虑到市民实际生活情况，那让城市更美好可能只是一句空话，事实上，生活在这里的市民，室外温度三十多度的时候，都必须戴着口罩出门，何来美好，只添痛苦。因此希望父母官能充分考虑到梧桐飞絮对于市民生活造成困扰的严重性，拿出切实可行的方法解决这一问题。当然，今年梧桐飞絮肆虐的日子快结束了，但至少应该可以拿出可供操作的方案留在明年初进行落实解决，期待能还给这一区域生活的市民一个真正绿色的生活环境。谢谢。,,,
徐汇区园南一村34号202违章搭建露台阳光房,待回复,城建 投诉,匿***,2017-05-0715:22,你好！尊敬鲍书记我想反应徐汇区园南一村34号202室非法把阳台拆除扩建4平方米违章搭建了阳光房，破坏结构制造了安全隐患，希望可以来实地勘察一下，恢复原样，创造一个和谐的社会！谢谢您百忙之中来为老百姓解决合理的诉求！,,,
社区发展事宜,待回复,交通 建言,匿***,2017-04-0814:54,您好，领导！华泾路1000弄小区地面高低不平，小区老年化也比较严重，小区内停车问题一直很难解决，周围交通也不是很好，附近也没什么商业，上海建设是每日大变样，为什么这块区域是百年不变，既没有轨道交通，也没有新增公交车，等车时间要比乘车时间长，请领导能到我们这块区域来体验一下。,,,
关于沿街居民区烧烤店油烟扰民,待回复,环保 投诉,匿***,2017-04-0314:01,我们住在零陵路曰晖一村属沿街房子，马路对面是足浴房、买海鲜的丶买菜的、买助动车修车的店，再向东点就有一家烧烤店，每天日夜不停的营业，到晚上5~6点钟开始排放油烟，放出的一阵阵油烟使行人个个掩鼻，半夜里的吵闹声仿碍居民睡觉。快进夏季了，我们不开窗通风能行吗！居民们纷纷打了N次的12345问题仍未解决。对这扰民之事巳反映=年多了。难道这损害居民的健康和破坏空气环境的事竟无人能管了吗？求鲍书记给民解扰，万分感谢。,,,
希望严禁赌博 赌博是多少家庭破裂,待回复,其他 投诉,匿***,2017-04-0216:51,我想举报上海市徐汇区 上海嘉华商务中心 里面有大型赌博 因为本人老公沉迷于赌博  夜不归宿  这是他发的定位 希望严打赌博  最近松江场子都差不多关掉了。大多数都跑到徐汇区各个地方 这个地方 是他们刚开始的 我不要奖励 我只要你们能严谨打击赌博,,,
一条小马路停车只能停一边,待回复,交通 投诉,匿***,2017-02-2406:57,尊敬的领导！徐汇区龙瑞路是一条东西方向的丁字路。为了配合滨江的开发，把临时收费的停车场取消了。让我们全部停车在龙瑞路上。这里住着中海瀛台1期与2期的居民。小区的停车位每家只有一个，现在小区每家的车子两部比较多，小区停车也比较难。很多跟我一样的也停在龙瑞路上。徐汇交警队执法存在钓鱼执法，我经常留意我们外地牌照的车辆，是经常被贴单。都是停在指定的区域，为什么上海牌照没有贴单？现在徐汇区交警队在今年2月16号在我们1期2期楼道里贴公告让我们2月20日起车辆只能停在龙瑞路北侧，南侧不允许停车。希望徐汇区交警队公平执法，南侧不允许北侧应该也不允许停车。希望区领导能够重视我们小市民的呼声。我也是按级反应，希望领导能够帮忙解决一下南侧北侧的区域可以进行收费，不然一个晚上一个罚单200元，让我们这些收入低的怎么办。,,,
上海虹桥机场乱收费,待回复,交通 投诉,匿***,2017-01-2521:23,上海虹桥国际机场办理临时身份证明收费30元人民币。其他城市全部是免费。收费主体是保安公司，理由是委托保安公司办理因为办证人提供不出来两寸彩色照片，办理临时乘机身份证明就是有特殊意外情况才办，不然谁会去办？再说谁又会把照片随身携带？他们照了像收取照相费，所谓照相就是摄像头，这是国家配置的工作设备，为何在上海就成了保安公司敛财的工具？其他机场也是摄像头照相都不收费，为何作为国际大都市的上海要变花样收费？依据何在？与国家提出的便民和不准乱收费要求是否相驳？收费30是小，违反国家和政府规定以及地方城市形象是大，请市领导过问并纠正一下，谢谢！,,,
56路公交车时间间隔长,待回复,交通 建言,匿***,2017-01-1217:52,56路公交车2017年开始换了新城，但是早高峰时段时间间很长，特别挤，希望增加车辆。,,,
被老板打了还不给我工资,待回复,就业 求助,匿***,2017-01-0109:06,我是一名外来务工人员，工作是送外卖，12月12晚上6点被我们老板3人欧打当天被辞退，我报了警可现在却一直拖着，他现在工资也不给我。给我作证的人的工资也不给他了，去劳动局也没用，现在没钱，房租快到期了，走投无路想向你求助。如您看到这条消息请打我电话。,,,
徐汇区华发路27号，赌博机老板十分嚣张,待回复,治安 求助,匿***,2016-12-0708:53,鲍书记您好，刚刚百度了一下，关于上海赌博机的负面帖子很多，作为全国文明大都市的上海，为什么赌博机会如此的泛滥，多次举报无果不说，还给自己的人生安全带来威胁，人被打成骨折，老板照样的开门做生意，在里面有的输得倾家荡产，妻离子散，这种灰色产业让人太寒心。现在是法治社会，希望这些黑心的老板早日关门,,,
云南盘龙世博园翡翠天价,待回复,旅游 求助,匿***,2016-11-2310:51,尊敬的书记您好 ！犹豫了好长时间打扰你百忙中给你述求，今年3月3号在白龙路世博园买了翡翠佛A货价13600元，货品100034000610，经手人82482，柜台28，银联卡买的。10月去做配件，几个内行师傅是我翡翠有裂痕不是A货，这是天价了。我被蒙了，这是送我母亲的生日礼物。我10月19号求助12315，转世博园来电说只能加价换超过一个月不能退，你说可好笑吗，一个挂件加价可以收，否则不能退，发票上没注明商品事项，也没有哪个销售员跟我们售后服务，何况又是坏的，那里是A货，身不由己人在上海。我很困惑求助艰难，没办法我想到了只能求助书记了，想到这笔冤枉钱我和母亲都很难过，几个月的工资啊，书记你要帮我主持公道，我要退货 如果这翡翠是值这价我也认了。谢谢 1祝书记工作顺利 1期盼得到您的回复，谢谢  ！,,,
上海徐汇梅陇十村高压线,待回复,环保 投诉,匿***,2016-11-2017:26,徐汇梅陇十村高压离居民楼仅10多米，存在重大安全隐患，如遇火灾，消防车都无法架云梯，严重侵害了百姓的生命安全，如遇此事，谁来负责！现电力公司一直敷衍了事，与居民没有任何沟通，请有关部门出面协调，帮上海市市民主持公道办实事！,,,
市南电力公司违规建高压塔，严重侵害百姓生命安,待回复,城建 投诉,匿***,2016-11-1917:01,市南电力公司违规施工，对投诉处理态度敷衍，边导线离高层居民楼仅10多米，存在重大安全隐患，如遇火灾，消防车都无法驾云梯，严重侵害了居民的人生安全，如遇此事，谁来负责！,,,
淮海西路建议,待回复,城建 建言,匿***,2016-10-1510:33,尊敬的书记:您好!淮海西路在徐汇区，但是淮海西路基础设施老旧，街道狭窄，希望书记关注一下，彻底改造淮海西路，架空线入地。,,,
举报我店旁边的赌博游戏机,待回复,文娱 投诉,匿***,2016-09-2814:50,书记：    你好！    我是一名反对赌博机的良好市民，在徐汇区龙水南路355号，开了一家水果店，经常看到店员到我店旁边的赌博游戏机房玩游戏，上班不好好上班，经常去输钱，里面有监控，可以随时看到警察来没有来，所以很多时候，警察都扑了空，因为他们看到警察来了，就把大门关了，无意中我去看看，发现有一种叫保单机的游戏机，看到一个人一把7000-8000人民币，不到1个小时输了10万，希望领导督促有关部门去管管！！这个游戏房在我水果店旁边，没有门牌号，我店门牌号是龙水南路355号，过来是叫福建千里香馄钝的左边，我店在福建千里香馄钝右边！愿书记健康，在百忙之中抽出时间管管！！！,,,
孤老求助请求政府解决困难,待回复,其他 求助,匿***,2016-09-2114:20,我是一个失独家庭，现孤身一人居无定所，原来租房居住，现随着房价不断上升，靠仅有的一份退休金无力负担，巳打电话12345求助。申请廉租房，但是承办单位告知我的退休金超出廉租房门槛二百多不能解决。求助政府解决我的困难，目前我是孤老,,,
加快旧区改造的步伐,待回复,城建 求助,匿***,2016-08-2920:20,   上海市徐汇区长桥新村是50年代未的老公房，小区环境设施陈旧，厨房间两家和三家共用，水池两家共用一个，每层楼面10家人家共用一个倒便器，夏天和冬天无法洗澡，每天早上如厕排队，小区到处是违章建筑，不管夏天和冬天，楼道周围和室外散发着臭气，这样环境居民多次反映未果，不知何时能帮助老百姓解决这些问题，给大家一个好的生活环境，希望区政府能帮大家办实事。由于上传图片真伪难辨，故希望有关领导能亲临现场查看。,,,
我想继续在延庆路开巴比馒头,待回复,城建 求助,匿***,2016-08-0520:23,尊敬的领导：您好，我在徐汇区延庆路10号做了6年巴比馒头，给附近居民带来了方便，今年上半年延庆路上查出了很多违章和无证的都搬掉了，还封了兰州拉面馆和保罗轮胎两家店铺，接着我的二房东就来通知说接到上面通知店铺不租了要我们搬出去，我们主动搬走了，这一搬损失了我们装修费用和整套做馒头设备。（我们证照齐全，我们不占道经营，我们合法经营，我们房便周边广大居民）。现在延庆路改造好了，希望领导优先考虑把店铺继续租给我们以减少我们的损失,,,
医院周边人行、盲道被自行车占据,待回复,交通 投诉,y***,2016-07-2616:42,鲍炳章 书记，你好：   反映在上海市第六人民医院(宜山路600号)门口和钦州北路(宜山路)一段人行道上停满自行车，盲道也被占据。这里本来路面不宽敞，医院路段人流量较集中，这么多自行车乱停乱放，叫路人和盲人怎么行走啊？医院周边人行道上乱停乱放自行车给行人(包括病人、盲人)正常行走带来了安全隐患。徐汇区正在创建全国文明城区，占据人行道盲道属于不合格，希望有关部门整治医院周边人行道上违规乱停车现象，建议相关部门协调在医院周边设立自行车停车场，确保医院周边人行道畅通。,,,
关于违法群租问题,待回复,治安 投诉,匿***,2016-07-2415:01,尊敬的领导你好，在徐汇区钦州路111弄6号2506室房屋里存在严重违法群租行为，该屋里摆满了上下铺床，由于床不够，还在地上打地铺，上上下下住了16余人。而且这屋为一室一厅一厨一卫，除了厕所，哪儿都是地铺。还存在男女混住，性质恶劣，房里臭气冲天，垃圾半月不扔一次，堪比垃圾堆，而且里面的床还是二手的，轻轻一晃吱吱作响，存在严重安全隐患，下面附上真实照片，由于太多拼在了一起，希望有关部门实施突击检查，确保检查质量。谢谢！,,,
卫生太差了,待回复,政务 投诉,匿***,2016-07-1019:36,书记你好。我 是上海市徐汇区建国西路288号上海建工二点集团工地工人，里面的食堂卫生太差了。吃饭的时候还有时候吃的剩菜。酸酸的 人得很多，工作人员什么口罩也没带过 当天没有卖完的，请问卫生局下来调查调查。,,,
拆迁幼儿园,待回复,教育 求助,匿***,2016-07-0916:19,像我家宝宝今年在银都幼儿园报的名，都开始上学了，突然通知我们学校要拆迁，要我们转校，校方校长不出面暑假班的费用也不退，报警警察说不归他们管，找教育局出面，他们也不问，最后家长们去到政府找说法，结果是只退了钱，可是宝宝学校怎么办，总不能不上学了吧！早就过了报名期，现在到处在找学校。如果回老家上学，对我们家影响太大，这种情况会有学校愿意接受收我家宝宝吗？,,,
上海徐汇区田林路140号游戏厅赌博严重,待回复,治安 投诉,匿***,2016-05-1217:26,上海徐汇区田林路140号越界创意园1楼（庆春电影院对面），有严重的赌博行为，游戏机是捕鱼机，使用电子币，窗口可以退钱；经常有人一会就输几万。后面靠近厕所有一个小门，里面有压分机。这些都是严重的赌博，每次都是警察来了后很快就走了，开了好几年，一直没有被打掉，这个情况是老板有多大关系，还是警察无法找到直接证据呢？ 如果加大力度管，警察可以便衣调查几个小时就可以有证据了。希望徐汇政府能把这个难啃的骨头拿下，这样下去迟早会出事。,,,
欣佳苑运动场太吵，严重影响居民休息！！,待回复,环保 投诉,匿***,2016-05-0913:56,你好，书记：     徐汇区钦州北路1018弄的欣佳苑小区靠河边的运动场，紧挨着小区最后好几栋楼不足5米，每天早上和晚上都有很多人运动，聊天，跑步，打球，这严重影响运动场旁边好几栋楼的居民休息。 特别是早上，有很多老年人早上5点钟到10点钟，就一直在居民楼旁边的运动场跳舞，聊天，打球，运动，唱歌，音响大喇叭声音也很大。导致周边居民楼的居民得不到正常休息，常失眠，影响正常工作。 特别是我们年轻人要上班，早上5点到9点基本都在休息。 建议拆除小区居民楼旁边的运动场，将他们还原为草地。 另外把运动场修到离居民楼远些的地方。 请领导尽快解决这个严重噪音干扰问题，还周边居民正常的休息权利。谢谢！！,,,
游戏机房危害社会,待回复,治安 求助,匿***,2016-04-2218:05,我是外地来沪务工人员，前几天听说一个老乡在我所住的地方在游戏机房输钱太多了，找游戏机房郑老板寻求帮助，被里面老板雇佣的社会闲杂人员恐吓威胁还被轻微的打了几下，打110报警也不了了之，因为输钱太多深陷其中不能自拔，工作也因为三天打鱼两天晒网而失业了，闹得老婆和他离婚了，孩子和老妈在老家也是苦不堪言。像这样的游戏机房，危害社会性虽然不招摇过市，但是危害性很大，而且听说很多人在哪里输的倾家荡产，走投无路，当地居民和受害人多次电话报警也是不了了之。希望政府部门能杀一儆百给受害人一个心里安慰，给不法分子一个警告。,,,
赌博游戏机,待回复,其他 投诉,匿***,2016-04-2113:50,上海市徐汇区长桥罗秀路410号隔壁在一个邓（郑）姓的人为首的带领下，聚集了一帮社会闲杂人员开了一个赌博游戏机房，搞的人倾家荡产，而且还使用暴力威胁等手段恐吓想报警的人。,,,
严打老虎机赌博,待回复,其他 建言,匿***,2016-03-1416:59,领导，您好：上海徐汇龙州路995号(近梅陇路)4楼上有一个打老虎机的地方，4楼上有KTV、台球、还有老虎机，我弟弟已经在那输了很多钱了，现在家人对他严格控制，但他还是像着了魔一样，有一点空隙就往那里跑，希望地方领导也能管理一下，严打老虎机赌博，跪谢。,,,
我的安全谁来承担,待回复,城建 投诉,匿***,2016-01-3015:04,我是一名普通老百姓，上有80多岁的父母，下有刚刚才上一年级的孩子，我住二楼，从2012底，我楼下来了新的户主，他为了自己，把公用的地方搭起了一间小房间，做成厨房间 ，我不同意他这样做 我2013两次到徐汇区，信访办，投诉无果，我的安全谁来承担。希望领导能在百忙中，为我主持公道！,,,
上海市徐汇区田林路65弄居民！,待回复,城建 求助,匿***,2015-10-2913:52,我是田林路65弄居民！65弄房屋我们都知道是煤卫不达标的房子！楼道里电线都老化了！一楼居民的违章建筑，导致我们两楼居民带来了安全隐患！期盼已久的改建！有数十家居民的不同意！这这项工程停了下来！真的很遗憾！我希望政府能出面把这份工作能够做好，解决居民生活问题，,,,
老虎机害人害已,待回复,治安 投诉,匿***,2015-09-2517:33,   我在斜土路小木桥路那附近上班，因为朋友在那里附近打老虎机，自己不规矩也去打老虎机了，我朋友同志都是输钱，我现在输了一万多，过年也没回家，我是在酒店上班做服务员，报警也没用，我都给老板下跪了钱也拿不回来，我也意识自身的错误，我只希望把我的血汗钱要会来，他那个店就在斜土路小木桥路光闽网吧楼下,,,
讨还学费,待回复,其他 求助,射***,2015-04-0609:22,尊敬的区委书记您好：我是一名执业医师，为了能顺利通过今年的中级考试，参加了贵区学胜文化传播（上海）有限公司旗下华夏教育网校的考前密训，100%通过协议班，包括：网校精讲课程，考试题库，考前密卷（最关键性资料，80%的必考题）。学费4000.0元正。可是交费后，所发资料没有网校精讲课程，我觉得上当了，要求退学费，他们说关键是考前密卷，保证通过，我觉得不可信，反复交涉，还是不同意退费。在这里希望领导在百忙之中介入调查，还我一个公道，让骗子无处遁形。,,,
无法申领户口,待回复,其他 求助,匿***,2015-01-1413:25,书记你好！我是安徽打工的，感谢国家政策让打工仔也能过上好生活。我是2004年在上海和我的爱人结婚的，《她是徐汇区华泾镇华建一街坊人》我04年养了个女儿，现在12岁了。在2012年的时候又养了个儿子，当时我问过居委会和镇计划生育，派出所。他们当时让我到安徽开个证明，证明可以生二胎，然后再生，我当时也到安徽把证明都开好了，小孩在10月3号养下来了，户口也顺利报好了《那时国家二胎政策还没有开始施行》。现在的问题是我的户口问题，在国家的政策下我10年以后可以申领上海户口，再我所有的材料都交到华泾派出所的时候，户籍民警告诉我说小孩没有准生证。《当时我小孩没有出生之前我问过他们，他们也没有要求必须办理准生证的，只说有证明就可以了》。现在要求我到安徽当地去办理准生证，都那么长时间了，我到当地人家也不给我补办。我现在不知道如何是好，希望书记能给我指导一下。谢谢,,,
徐汇区田林路动漫城赌博机猖狂当面退钱,待回复,文娱 投诉,匿***,2014-11-2415:03,上海市徐汇区田林路140号越界创意园区一楼 电影院旁，动漫游戏厅，大量赌博机，一直开张，关门最多2-3天又重新开张，当面退钱。,,,
来沪几年 想让孩子在上海上学,待回复,就业 咨询,x***,2014-11-2011:02,我是外来的务工人员，在上海徐汇大木桥路已有7年，小孩以前在老家由外公外婆带，由于老家穷没有在上海上幼儿园，我儿子也上幼儿园了 我老爸、老妈年龄都60多了 ，带不动 想让他们二老享享清福 我也好给老婆、儿子、女儿在一起  现在在老家已上一年级，现在想让小孩转过来上学，却上不了学，因为找不到学校。我们到处找学校都说满了，现在我们真的是一点办法也没有，心急如焚！如果到了九月一号还是没能找到一所学校，我真不知道以后该怎样面对孩子。我也不知道莫书记能否在百忙之中能看到这封信，但我报着一线希望向您求助！,,,
居民小区无人管理，外来人员赌博成风,待回复,征集 群众路线,匿***,2014-09-1910:39,上海市徐汇区龙华路2381弄系原东航小区，建造年代较早，内部配套陈旧老化。长年来成为“三无二多”居民区。小区内多年一直存在无物业、无安全、无人管，外来人员多、赌博窝点多的“乱象”，原住民（老人居多）多次反映无果。居委、派出所、枫林街道、东航公司、区房地局（房办）、区政府应否给予综合配套解决？请真正从行动上彰显勤政爱民，真正把党的群众路线教育实践活动落到实处！,,,
求助信,待回复,征集 群众路线,匿***,2014-06-3016:50,无心非  名为错  有心非  名为恶求助信尊敬的领导：您好！ 本人陶建国是上海市徐汇区建国西路248弄24号居民。房屋性质：祖上私房。责任单位：上海嘉兆房地产开发经营有限公司（以下简称:嘉兆房开发）。履行责职单位:上海市城市建设和交通委员会履行责职单位:上海市徐汇区城市建设和交通委员会社会要发展，规划要合理。旧区改造.改善居民居住环境，提高居民生活质量是利国利民好事。求助事一. 嘉兆房开发在2006年建房基础施工时，未按规划红线退让，未按图施工， 擅自变动施工图。扩大(地下车库)面积，在仅离我们房屋墙1.5米距离打一排桩，排桩深20米。房地产开发商的野蛮施工直接导致我们居住的房屋成危房： 1. 地基松动位移。整幢房屋向地下车库方向倾斜。 2. 房屋屋顶漏水和墙体严重开裂且20多处漏水。3.   嘉兆房开发违法施工导致我们全家长期居住在危险房屋里。生活用排出水管道以及化粪池给嘉兆房开发故意堵塞，导致室内污水存积，导致发酵泛臭至今。多年向各级政府部门反应，未能得到合情.合理.合法的答复。 4. 嘉兆房开发建小区围墙超越规划红线与警察构结，强行施工。求助事二. 上海市规划和国土资源管理局行政行为瑕疵在2001年旧区改造规划时上海市规划和国土资源管理局行政行为违法，在本人及居民(不知情的情况下) 把我们居民唯一通往建国西路的道路土地使用权拍卖给 嘉兆房开发使用。此道路上海解放前已存在，宽达4米。现被嘉兆房开发留出，通往建国西路的道路仅1.6米宽，开发商说：“此路我们卖下了，有我们说留宽多少就多少，沒有居民说话权”。依据中华人民共和国《消防法》居民小区消防通道应在4.6米宽。 为了维权求决本人长期奔波于上海市徐汇区人民政府信访办，上海市人民政府信访部门. 北京等各部门反映情况时总感到自己是“一个病人”， 各部门以及徐汇区人民政府信访办是“医院”，“医院”只挂号，不治病。特别是上海市徐汇区城市建设和交通委员会不履行责职， 装疯卖傻。一路走来体会到上访道路坎坷？ 人间正道是沧桑垦求中央领导督促违法责任单位还民安全权，尽快解决我的求助。                                                  求助人： 陶建国 联系地址：上海市徐汇区建国西路248弄24号  电话：138-1758-2263,,,
