标题,状态,领域,用户名,时间,内容,回复单位,回复内容,回复时间
上海松锦劳动公司黑中介，殴打学生无法无天！,待回复,治安 投诉,匿***,2014-06-2817:03,我是上海的一名大学生，2014年6月25日通过赶集网看到三星电子厂招人还注明直招，非中介。然后黑中介，给我们地址，说是厂址直接过去面试就好了。等我们到了环城路汽车东站后发现这是一家中介公司而不是所谓的工厂，然后就质问为什么把我们带到中介来了。然后上海松锦劳动公司的一位穿黑色条纹40多岁的胖子，估计是老板。然后就开始态度恶劣。指着我的鼻子对我说：你算老几？这里找工作的人多的是，你不做就给我滚出去！我说：你干嘛？。然后他们公司的人全都冲上来，其中一名白色衣服的胖子，对我就是一巴掌甩起。我想反抗，然后5个人把我按在沙发上打，然后这5个人接着把我拉在地上不停的用脚踢，全身都被踢了，眼镜也被打碎了。外套被撕破了！手机也掉在了地上，我想过去捡起手机，还没捡起。穿黑色条纹衣服的胖子就把我拖到外面进行殴打。我眼睛被打肿了，脸上被鞋子踢了一天很深的伤口。现场流了很多血。下巴和嘴被踢肿了。就下了血印。脑袋也被打肿了。我的同学一边求着别打了，再打就出人命了。黑中介还是不停的打，后来路人拉开才结束了被殴打。我跑到店里想检手机报警，店里殴打我的人对我说：手机扔了，叫我滚出去！并威胁我说，至今为止还没人敢报警，你居然敢报警，警察来了又怎么样？。然后我就用我女朋友的手机报了警。在警察10分钟过来后，其他人都跑了，只抓到一个黑子瘦个子！抓进了牢里。做完笔录，民警给了我验伤单，由于我一个学生，没钱去医院检查，伤情赔偿不了了之。民警对我说，这家黑中介总是闹事，我都出警很多次了。想把这家黑中介关掉，又关不了！民警只要其赔偿了我1100元(犯人身上所有的钱了)，损失的实际是不止的，大概损失了1300左右，我怕遭到报复就赶紧回学校了。回到学校后上网查看，发现很多关于上海松锦劳动公司的骗人信息，很多人举报黑中介殴打学生，骗人钱财。我想恳求领导，对该黑中介公司进行严厉查处！封锁黑点，不要让其态度嚣张，无法无天！去坑害更多的学生！同时还我一个公道，赔偿我身体上所受到的伤害，和精神损失！,,,
变更公房住宅承租人的事,待回复,征集 群众路线,匿***,2014-06-0914:26,  我叫胡文全，家住上海老沪闵路1290弄15号302室。原先我母亲是承租人的承租房。l0年6月母亲去世，母亲生有五个儿子，除了老大胡文虎想独占母亲房子以外，其余四位儿子都认为母亲的承租房是独门独户的，可在市场上置换成价额，此房就作母亲遗产。而老大胡文虎不同意，几年了问题解决不了。我反映到徐汇区房管局来指导、协调、监督这项工作。区房管局信访办答复:“该房屋变更租赁户名的事项不属于我单位行政管辖范围”。这样推诿再反映，只是“不重复受理”。房管局规章制度表明:负责物业管理的行业管理，组织协调并监督物业管理的行政执法工作。指定承租人的单位是上海申岭物业管理有限公司，业务指导是房管局，下属单位做的不对，房管局要指正。而不是说不属于行政管辖范围，而是要牢记属于行政监管范围。希望通过您们，抓落实活动中，解决变更承租人的问题。,,,
田林宜山路，钦州北路机动车违章停车严重,待回复,治安 咨询,匿***,2014-04-1714:25,请交警作为，为民服务，还市民一条畅通路，让市民出行方便。,,,
外地知青的工资问题,待回复,其他 求助,匿***,2014-04-0215:02,我是上海下放安徽的知青.感谢政府让我们回沪定居于子女团聚.现在我们的工资本来就少生活水准在不断的下降.每年上海人要加到200到300左右我们外地只加了100多点我们想政府是否能想法子减少这种差距.因为我们很苦的.谢谢政府.,,,
打工外来人孩子为啥不让上幼儿圆或就近上学,待回复,教育 两会,匿***,2014-02-2610:45,我家孩子在徐汇区打工孙子为啥不让上幼儿园他们已经办理了居住证听说去年还可以今年为啥改革不行了呢,,,
赌博,待回复,治安 求助,匿***,2014-01-2711:26,徐汇区龙水南路363号开了个棋牌室，警察去了很多次，都没有关闭，晃晃麻将现在不是不允许开了吗，你们能帮帮忙吗，爸爸来了，都不回家了，对不起不能留自己的姓名，他们警察局有人,,,
黑网吧！老虎机影响太坏了、孩子都不上学了,待回复,治安 投诉,匿***,2014-01-0915:38,黑网吧！老虎机影响太坏了、孩子都不上学了！我儿子一开始学习很好、现在天天去黑网吧上网。还偷钱。夜里不回家。现在经常说肮脏话，我去网吧找、网吧里面人还威胁我、里面大多全是未成年人、希望各位领导帮一忙。地址：徐汇区虹漕南路48号、冷库旁、波璃门、门被贴上白纸伪装成一个修鞋店。希望领导反应一下,,,
标题,状态,领域,用户名,时间,内容,回复单位,回复内容,回复时间
