黄龙玉骗局,已办理,旅游 投诉,我***,2019-03-1408:10,书记你好，本人三月去云南旅游，我于2019年3月8号被大理导游带去丽江市古城区民主路203号维客购物广场2楼珠宝购物点买翡翠，现回到工作地点东莞，找懂行的人看了根本不值7000多块钱，最多只值三五百，虽然让我们支持云南的发展也不用这么坑我们吧？我们对云南的旅游事业感到担忧，导游的虚假宣传，低价商品充好假卖给我们，欺骗游客，再也不想去第二次了，马上315了，望书记能帮忙协商处理一下，好好整理一下云南旅游业的蛀虫吧！,古城区旅游局,网民同志：您好！    您通过人民网地方领导留言板给古城区委书记的留言收悉，古城区委区政府高度重视，及时责成古城区旅发委认真调查处理，经核实，现将有关情况回复如下：    您于2019年3月8日在民主路维客购物广场购买黄龙玉观音7680.00元。因当时未事先联系被投诉单位（维客），于3月10日下午6点15分投诉到人民网。维客发现投诉事件后于晚上8点加了您微信进行沟通处理，维客售后当时就同意退货，并于3月11日下午7点通过微信转账给您7680元，并同意您先退款后退货。    感谢您对我们工作的关心和支持，希望您继续监督我们的工作，顺祝您生活愉快！,回复时间：2019-06-21 01:22
关于束河购买的黄龙玉退货问题,已办理,旅游 感谢,w***,2019-02-1411:02,目前已经正在办理退货，待退款，给书记和商家带来不便，表示感谢及歉意。,古城区信访局,网民朋友：您好！感谢您对我们工作的肯定、理解！,回复时间：2019-02-26 09:20
束河古镇购买黄龙玉，要求退货,已办理,旅游 投诉,w***,2019-02-1317:40,于2019年2月10日，束河古镇内聚宝盈商号购买黄龙玉，价格虚高，要求退货,古城区书记区长信箱,网民同志：您好！  您通过人民网《地方领导留言板》给古城区委书记的留言收悉，古城区人民政府高度重视，及时责成相关部门认真调查处理，翌日收到您的5300002019021590012号信件，表示已正在办理退货退款事宜。感谢您对我们工作的支持与理解，祝您身体健康、生活愉快！,回复时间：2019-02-28 14:11
导游带去银庄买银子,已办理,旅游 投诉,雯***,2019-02-1117:18,买回来的银子产生了变色，价格也虚高了，18.8一克，别的小店6-7一克。导游带去非让买一个做纪念，想申请退货寻求帮助,古城区旅游局,网民同志：您好！   您通过人民网《地方领导留言板》给古城区委书记的留言收悉，古城区委区政府高度重视，及时责成古城区旅发委认真调查处理，现将有关情况回复如下：   收到您的网上信访件后，我委第一时间通过古城区旅游质量监督管理所工作人员联系到您进行沟通，您答复此事已由市旅发委进行了处理，并已补发了增值税发票。   感谢您对我委的工作的支持与理解，祝您身体健康、生活愉快！,回复时间：2019-03-28 01:21
关于雪山艺术古镇退款难的问题已经解决,已办理,城建 感谢,赵***,2019-01-3017:10,关于雪山艺术古镇退款难的问题已经解决。感谢领导们的帮助，祝您们新年快乐，工作顺利，万事如意！,古城区书记区长信箱,网民同志：您好！     感谢您对我们工作的信任理解与肯定，祝身体健康、新春愉快！,回复时间：2019-02-01 01:19
丽江雪山艺术古镇退款难,已办理,城建 投诉,赵***,2019-01-0908:24,您好，尊敬的书记！我是浙江人，八月份去云南旅游时认筹了丽江雪山艺术古镇的一套商业用房，与九月份正式认购了，并催促我交齐首付款。由于开发商没有和银行对接好，不能办理按揭，所以首付款未交，在十一月底要求退还定金两万，开发商迟迟不给解决，拖至今日也没有给出结果。无奈之下，请求陈书记百忙之中抽出时间帮我解决一下问题，谢谢书记,古城区住房和城乡建设局,网民同志：您好！    您通过人民网《地方领导留言板》给古城区委书记的留言收悉，古城区委区政府高度重视，及时责成区住房和城乡建设局认真调查处理，现开发商已与当事人对接退款事宜。    感谢您对我们工作的支持与理解，祝您身体健康、新春愉快！,回复时间：2019-01-30 01:20
求求书记帮帮我讨回公道,已办理,旅游 投诉,y***,2019-01-0122:18,2016年我们一家三口来到梦想中的云南旅游，跟团旅游的！导游说我们属于购物团必须买东西不然要补够团费，当时在滇缅玉石城买了一个手镯，标价是六万六千多，回来后朋友都说不值，请专业人士帮我看了说差不多值三千多，我就打售后服务电话，售后就成空号了！我分别电话去云南物价局和工商投诉，至今没有得到回应！求求书记帮我讨回公道。万分感谢！,古城区旅游局,网民同志：您好！    您通过人民网地方领导留言板给古城区委书记的留言收悉，古城区委区政府高度重视，及时责成区旅发委认真调查处理，现将有关情况回复如下：    您所反映的关于滇缅玉石城购买玉石购货退货问题，按照原国家旅游局制定出台的《旅游投诉处理办法》第九条第四款之规定，已超出了90天的旅游投诉受理时限；其次，自2017年全省旅游市场秩序整治专项行动开展后不久，滇缅玉石城就已停业并转向经营。所以，您的投诉不予受理。    旅发委质检所工作人员已与您沟通，感谢您对我们工作的支持与理解，祝您身体健康、生活愉快！,回复时间：2019-01-17 01:20
洒水车小区附近抽水扰民,已办理,环保 投诉,a***,2019-01-0110:13,这一个星期以来，每天早上8点多都有一辆云P25605牌照的洒水车来我们小区墙外的沟里抽水，声音特大，一抽就是半小时，上午一次，下午一次，大人还好，可我家有刚刚出生的小宝宝，没次都被吵醒，请领导落实一下，洒水车这是属于正常工作还是违规操作，地址在庆云东路正泰和苑旁这条水沟边，谢谢,古城区书记区长信箱,网民同志：您好！    您通过人民网《地方领导留言板》给古城区委书记的留言收悉，古城区人民政府高度重视，及时责成丽江三朵园林公司认真调查处理，现将有关情况回复如下：    经了解，云P25605洒水车为公司生产用车，负责完成丽鹤路每周两次绿化苗木浇水工作任务（每周二、周五），该车夜间停放于公司停车场内，工作人员每周二、周五早上八点半从公司抽水并前往丽鹤路浇灌苗木；为节约油耗，确保工作效率，第二次抽水就近在丽鹤路水沟内抽水，时间大概在九点半至十点左右。    根据目前您所反映的情况，本着不影响附近居民，又能完成公司绿化养护任务的宗旨，已要求该车不再在原位置进行抽水作业。    再此感谢社会各界人士对城市绿化管理工作的关注与监督，公司将尽量杜绝工作中扰民的现象。祝您身体健康、生活愉快！,回复时间：2019-01-18 01:19
关于《古城区瑞宝商号翡翠低价高卖》退货事宜,已办理,旅游 感谢,爱***,2018-12-1110:47,尊敬的领导，商家已经联系我了，也接受可退货申请，烦请撤销对瑞宝商号的投诉，谢谢领导，感谢,古城区书记区长信箱,网民同志：您好！  您通过人民网《地方领导留言板》给古城区委书记的留言收悉，感谢您对我们工作的支持与理解，祝您身体健康、生活愉快！,回复时间：2018-12-18 01:19
古城区瑞宝商号翡翠低价高卖  请领导做主,已办理,旅游 投诉,爱***,2018-12-0914:33,尊敬的领导，上个月参团去丽江游玩，因为经常旅游，这次选到了丽江，想感受一下丽江的魅力，人人向往的好地方，具体来说本次旅游感受还是不错的，路上导游讲解云南风情，旁敲侧击的一路到卖翡翠的地方，说是政府改革旅游，现在都是政府定价，国家估价师估价，而且政府大力支持，现在是买翡翠的好时候，而且每年增长百分之十，现在价格最低。还说这么多云南的工作人员为你服务，不买说不过去，想着也是，来到云南了，翡翠肯定也挺好，也得买点东西，为云南旅游做点贡献嘛，我买了一个翡翠手镯，翡翠貔貅，两对翡翠观音《已送人》，还有云南特产雪花银手镯，近两万元，回到山东后，一个做玉石的亲戚碰巧看到了，就帮忙鉴定，说是价格虚高太多太多，物非所值，所以想退货，这么高的价格买到的东西不值这个价钱，心里很失望，本身我就是一个小职员，一年挣不了多少钱，现在家里人都说我，一家人为了这个人还吵架，我心里也非常不得劲。希望能把翡翠退掉，给销售人员打电话说是不给退货，让我给导游联系，导游也不回复，想退回手镯一只，貔貅一只，挽回部分损失，希望领导能帮忙协调，万分感激。地址是古城区具体不知道在哪，收据显示为古城区瑞宝商号.,古城区工商局,网民同志：您好！    您通过人民网《地方领导留言板》给古城区委书记的留言收悉，古城区委区政府高度重视，及时责成古城区市场监督管理局认真调查处理，，现将有关情况回复如下：    12月10日致电商家同意退货，待消费者把商品寄到后退款。12月14日联系商家称12月13日已收到货，12月14日下午已退款给消费者。    感谢您对我们工作的支持与理解，祝您身体健康、生活愉快！,回复时间：2018-12-22 01:20
环境问题,已办理,环保 建言,我***,2018-11-2413:42,尊敬的领导：       您好，位于旅游学院转盘下面大隆汇超市旁边，有好几家露天卖烧烤，一到晚上7点左右，乌烟瘴气的，烧烤烟特别大，远远都能看得到一股股烟直排冲到柳树上，希望领导能派相关部门暗访，,古城区束河街道办事处,网民同志：您好！  您通过人民网《地方领导留言板》给古城区委书记的留言收悉，古城区束河街道办事处高度重视，结合我区创文工作，组成夜间工作组，对辖区内重点区域的流动摊贩、烧烤摊等进行相关规章制度的宣传及劝导。感谢您对我们 工作的支持与理解，祝您身体健康、生活愉快！,回复时间：2018-12-29 01:20
关于丽江古城区瑞宝商号退货已解决事宜,已办理,旅游 感谢,阿***,2018-11-1017:48,丽江古城区政府的效率之高，瑞宝商号工作人员态度优良，已同意退货。烦请撤销此2018年11月7日对 瑞宝商号关于《丽江古城区瑞宝商号高价售卖低价翡翠》 的投诉。万分感谢。,古城区书记区长信箱,网民同志：您好！  感谢您对我们工作的信任理解与肯定。祝身体健康、生活愉快！,回复时间：2018-11-17 01:19
丽江古城区瑞宝商号高价售卖低价翡翠,已办理,旅游 求助,阿***,2018-11-0907:02,尊敬的丽江领导，本人于11月4日参团来到丽江，一路上导游还强调滇缅玉石由于是政府扶持，所以价格低质量好，每年增值10%，并一个月内可退换。因为相信政府，也为了贫困地方做贡献，所以我买了一个貔貅，17800元，回到深圳让做玉石生意的朋友也帮忙鉴定 ，说最多值2000元，为此事彻夜难眠，我也是普通职员，这么贵的价格却如此不幸，价格虚高，物非所值，所以想退货，希望领导百忙之中协调此事，感激不尽！1.购货地址为古城区瑞宝商行2.现在并不知道瑞宝商行在什么位置，也无地址，仅仅知道是在丽江古城附近,古城区书记区长信箱,网民同志：您好！  您通过人民网《地方领导留言板》给古城区委书记的留言收悉，古城区人民政府高度重视，经协调，商家已做退货退款处理，感谢您对我们工作的支持与理解，祝您身体健康、生活愉快！,回复时间：2018-11-17 01:19
家附近的站街女求治理,已办理,治安 投诉,过***,2018-11-0708:31,丽江市古城区民主路（狮子山背后）七星二街至金凯广场路段，醉汉、夜晚站街女大量聚集在该路段，作为仅剩的几家原住民不堪其扰，生活安全存在极大隐患！作为一个带着孩子的母亲，就连散个步都无数次在进出家门的时候被人以问“价格”为由纠缠不休，在自己害怕的同时，还要保护自己的孩子，面对孩子的疑问，作为母亲我该如何回答？家中单身女性基本晚上不敢独自出入！如何教育小孩？同时，该路段也是去古城的重要路段，对丽江的城市形象也极大地影响！望有关部门给予彻底整治！还我们一个清净的家园，清除丽江城市环境的一个毒瘤！,古城区公安局,陈先生/女士：您好！    您通过人民网地方领导留言板给古城区委书记的留言收悉，古城区委区政府高度重视，及时责成古城区公安分局认真调查处理，现将有关情况回复如下：    我局一直以来对卖淫嫖娼等社会丑恶现象进行严厉打击处理，西安派出所于近日在金甲村一带查获卖淫嫖娼人员和拉客揽客人员，根据《中华人民共和国治安管理处罚法》对以上查获的违法人员予以了行政拘留处罚。今年来，我局西安所已有效开展了打击处理卖淫嫖娼和拉客揽客违法行为，同时派出所协同旅游警察大队查处打击卿云巷、金甲村组织介绍卖淫刑事案件多起。    在今后工作中，我局将进一步加大打击力度，缩小违法犯罪行为的生存空间，进一步净化社会环境。    感谢您对我们工作的支持与理解，祝您身体健康、生活愉快！,回复时间：2018-11-21 01:19
住丽江客栈老板不退压金,已办理,旅游 投诉,莫***,2018-10-0909:18,尊敬的云南省人民政府领导，您们好！本人于2018年10月4号在丽江入住名为“王者居”客栈，5号离开该客栈，没有退回押金，刷卡形式支付（酒店住宿的形式就是直接返回押金入卡）当晚致电客栈负责人，负责人接通后以正在忙为由挂掉电话，说稍后回复，于是等到5号中午12点多一直没有回复。再次致电王者居负责人员，又表示在忙，随即挂断电话。当天联系了丽江市旅游局，以及12315都没有得到回复及处理。致电12301，回复说只能找丽江当地旅游部门处理。作为外地人到丽江旅游，很多地方都是不懂，遇到这类麻烦的事情除了求助政府部门，没有其他任何办法，显得非常的无助，伤心，难过...请问这个事情我该如何处理？谢谢！,古城区书记区长信箱,冯女士：您好！  您通过人民网《地方领导留言板》给古城区委书记的留言收悉，古城区人民政府高度重视，现将有关情况回复如下：经丽江古城保护管理局执法局到现场了解情况，客人通过朋友预定10月4、5日两晚三间家庭房（押金800元），5日下午15时，客人临时取消当晚订单，客栈方与客人协商先退还一半押金，若当晚房间售出，客栈方再退还剩余押金。由于当晚房间未能售出，剩余押金未退还客人。10月10日，经执法局协调，客栈方已退还全部押金。感谢您对我们 工作的支持与理解，祝您身体健康、生活愉快！,回复时间：2018-10-23 09:42
束河古镇小遇客栈住宿,已办理,旅游 投诉,w***,2018-10-0115:44,已在网上订好两晚，晚上11点多到，说没有订单，就到后面客栈住了一晚，第二天早上拿行李去办入住，前台没人，打网上电话预定电话起码十几次没人接，最后在门口看到一个电话才找到人。早上赶着要出去，东西放前台，中途打了两次电话让老板帮忙晾下衣服，到晚上回来时，行李还在前台，没放在房间内，湿衣服也没有晾。看后实在气愤，要求不住，退房，困扰太大，最后只能报警处理。第一，不论我们当晚几点到，既然接了我的单就不能把房间给别人住，给我造成了很大的麻烦！第二，不能存在侥幸心理，客人订了房，没到的话至少打个电话问下，怎能到了说没房，那客人订房有什么意义！第三，办理入住手续太慢。希望可以给予客栈整改意见，加大服务意识。,古城区旅游局,李先生/女士：您好！    您通过人民网地方领导留言板给古城区委书记的留言收悉，古城区委区政府高度重视，及时责成古城区旅发委认真调查处理，现将有关情况回复如下：    经我委质量技术监督所协调处理，我委已对涉事客栈提出批评教育，加强对客栈服务质量进行整改。感谢您对我区旅游质量的关心！祝您身体健康、生活愉快！,回复时间：2018-10-31 01:19
香格里拉迪庆土特产药材,已办理,旅游 咨询,w***,2018-09-2610:37,9月25日到了古城门口，导游说有学生义务者带我们去逛，直接进了一家卖药材的店，药材价格在下图，想问下价格是不是高了很多，可否退款退货，谢谢。,古城区旅游局,网民同志：您好！您通过人民网地方领导留言板给古城区委书记的留言收悉，古城区旅游局高度重视，现将有关情况回复如下： 您的留言内容不清，责任主体不明，又无联系方式（所留联系方式无法联系到您），无法交相关责任主体单位处理，请您谅解。若有不尽之处，可直接向我市旅游投诉热线反映：0888-5123432。感谢您对我们工作的支持与理解，祝您身体健康、生活愉快！,回复时间：2018-12-28 01:19
丽江束河古镇木家老院高价售卖低质翡翠,已办理,旅游 投诉,云***,2018-08-1510:07,尊敬的丽江领导，本人于8月13日参团来到向往已久的云南丽江，一路上导游还强调滇缅玉石由于是政府扶持，所以价格低质量好，每年增值10%，并一个月内可退换。因为相信政府，也为了贫困地方做贡献，所以我买了三个镯子，可是今天，也就是8月14日发现有裂纹，做玉石生意的朋友也帮忙鉴定 ，结果超级打击人，其中一个2万2的镯子只值2千元，为此事彻夜难眠，我也是普通职员，这么贵的价格却如此不幸，价格虚高，物非所值，所以想退货，可却告知不能退！希望领导百忙之中协调此事，感激不尽！,古城区旅游局,网民同志：您好！    您通过人民网地方领导留言板给古城区委书记的留言收悉，古城区委区政府高度重视，及时责成古城区旅发委认真调查处理，现将有关情况回复如下：    2018年8月15日上午11点30分，我委调度中心收到区委宣传部转办的人民网网友投诉束河古镇木家老院高价售卖低质翡翠的网络舆情，在第一时间协调区市场监管局执法大队工作人员赶往束河古镇木家老院进行调查处理，具体情况如下：一、经过认真协商，束河古镇木家老院负责人同意接受了您出的退货退款要求，并及时向您退还了购买的3个手镯的全部款项共计54634元，您对本次协调处理结果表示满意，并在人民网跟帖留言；二、区市场监管局就此次舆情涉及到的一些问题，已对束河古镇木家老院核查，相关工作正在进行当中。    感谢您对我们工作的支持与理解，祝您身体健康、生活愉快！,回复时间：2018-08-28 01:17
定向医学生毕业后卫计局不履行就业协议,已办理,就业 投诉,全***,2018-08-0321:13,"  书记,您好!我是定向于丽江古城的订单定向免费医学生。上大学前我们与古城区卫计局签署就业协议,承诺我们毕业后纳入编制管理,享受基本工资、医保、养老等一系列社会福利,我们觉得丽江是一个美丽的城市,从而选择了为丽江的基层医疗服务。然而当我们本科毕业后，古城区卫计局找各种理由不履行协议,不为我们安排编制。  18年丽江古城区事业单位医疗系统仍然招聘多名编内人员,也就是说编制名额是有，但是就是不给我们落实,更没有任何社会福利,生病了连医保都没有。目前整个云南省除了丽江古城区、玉龙区外,全部都给我们全科医学定向生落实编制等社会福利,古城区给我们落实编制真的就那么困难吗?我们一心响应国家号召,立志为基层医疗贡献力量,但是丽江古城区卫计局的做法另我们感到心寒, 打击了我们的积极性。政府部门应该说话算话，况且有白纸黑字的就业协议，他们公然违约的行为损害了政府部门的公信力。按照公证过的协议,如果古城区卫计局违约，我们有自谋出路而不用承担违约责任的权利,但是我想国家培养我们的目的并不是让我们自谋出路，我们也想安安心心工作学习,踏踏实实为基层服务。为了让我们得到应有的待遇，让我们安心为基层服务, 我们恳求书记为我们主持公道,让我们得到公平公正的对待,谢谢书记!",古城区书记区长信箱,网民同志：您好！  您通过人民网《地方领导留言板》给古城区委书记的留言收悉，您此件留言与2018年7月22日给丽江市委书记的留言相同，我们正在处理中，请耐心等待。祝身体健康、生活愉快！,回复时间：2018-08-08 01:17
丽江《云玉集团》白沙黄龙玉花卉艺术馆，托工资,已办理,企业 投诉,还***,2018-03-2110:15,丽江《云玉集团》白沙黄龙玉花卉艺术馆，拖欠员工长时间工资，给很多员工带来生活上的负担，3月份老板就说以后都是每月按时发工资，可是到了现在连1月份的工资都还没发，现在很多员工都是交不起房租，连吃饭，上班的交通，生活都不能保障了，非常希望能有丽江的领导出来给我们说话。,古城区书记区长信箱,网民同志：您好！      关于该信件反映的企业，不属我古城区管辖，建议您向玉龙县人社部门反映解决。感谢您对我们工作的支持与理解，祝您身体健康、生活愉快！,回复时间：2018-03-23 01:15
束河古镇北门九鼎龙潭至赛拉维客栈没有路灯,已办理,城建 建言,丽***,2017-12-2413:53,束河古镇北门九鼎龙潭至周边客栈都没有路灯，晚上客人出行极其不便，也不安全。,古城区束河街道办事处,网民同志：    您好！您通过人民网地方领导留言板给古城区委书记的留言收悉，古城区委区政府高度重视，及时责成束河街道办事处认真处理，现将有关情况回复如下：    现束河古镇已准备建设束河古镇智慧灯杆项目，项目建设将覆盖整个古镇。现项目已进入立项阶段，我街道将积极推进项目的建设。    感谢您对我们工作的支持与理解，祝您身体健康、新春快乐！,回复时间：2018-02-15 01:15
束河古镇鹿苑路东北饺子馆路口车辆违停占道,已办理,交通 建言,丽***,2017-12-2317:21,束河古镇鹿苑路东北饺子馆路口车辆违停占道(当地乱推车摆摊卖水果等)严重影响游客正常出行，建议旁边空地可改成停车场。,古城区束河街道办事处,网民同志：    您好！您通过人民网地方领导留言板给古城区委书记的留言收悉，古城区委区政府高度重视，及时责成束河街道办事处认真办理，束河古镇管理所及交警中队将加强巡查力度，逐步合理优化停车场等交通设施的设置。感谢您对我们工作的支持与理解，祝您身体健康、新春愉快！,回复时间：2018-02-15 01:15
束河古镇北门及北门晓梦庄酒店旁经常性乱停车,已办理,交通 投诉,丽***,2017-12-2317:21,束河古镇北门及北门晓梦庄酒店旁经常性乱停车，旁边有两个收费停车场却偏偏不停，因为是北门的主路，已严重影响游客及当地居民的正常出行！建议安装违章停车摄像头及禁停标牌。,古城区束河街道办事处,网民同志：    您好！您通过人民网地方领导留言板给古城区委书记的留言收悉，古城区委区政府高度重视，及时责成束河街道办事处认真办理，街道将继续加大交通秩序整治，合理优化交通标牌设置。    感谢您对我们工作的支持与理解，祝您身体健康、新春愉快！,回复时间：2018-02-15 01:15
