三义机场喊客拉客,待回复,旅游 投诉,W***,2019-12-0208:20,在丽江三义机场，三义宾馆路口和三义映象酒店路口，每天上午出现多名喊客拉客的人员，推销到丽江各个旅游景点玩，拉市海茶马古道，观音峡，雪山，千古情等、从中获取利益、严重扰乱旅游市场持续和公平，望领导重视,,,
黄龙玉问题已解决，非常感谢胜兴商行,待回复,旅游 感谢,家***,2019-11-2508:33,尊敬的领导您好：         11月23日凌晨12点对胜兴商行投诉情况说明，首先我本人没有第一时间联系胜兴商行售后就直接在地方领导留言向领导求助退货。因为听了别人的片面之词感觉受骗心急，朋友又给建议下载地方留言在留言板投诉退货快，心急没有和商家售后沟通直接发帖留言，商家在第一时间知道我的诉求在没有收到货品的前提下就给予我退货退款，我没有想要投诉的意愿，在此向商家表示歉意造成了不必要的误会。经过这次退货事件让我体会到了胜兴商行的诚信，我非常满意！对于云南的旅游我后续也会支持经常到丽江这个美丽的地方，告知朋友可以放心游玩！,,,
丽江古城区胜兴商行购买黄龙玉感觉被骗，求退货,待回复,旅游 求助,家***,2019-11-2319:15,尊敬的领导您好！我是一名广西壮族自治区游客，在2019年11月6日参加的6日5晚云南游来到云南，一路感受到云南的文化历史之优美，风景如画，这是我在家乡未能感受到的。一路换了2个导游，但是导游也很热情。美中不足的是安排的三次购物行程，其中黄龙玉购物，导游说黄龙玉是云南特色、价格低于翡翠，被称为国玉。旅游购物也是为丽江人民贡献GDP。本人也响应政府拉动当地经济，就购买了一件黄龙玉手镯，时间比仓促，买完就急匆匆的进入其他行程。隔了两天返回广西后，有懂行的朋友看了，告知价格虚高很多，有被骗的嫌疑。购买单价为12000的手镯，成色一般也就1000多元的价钱。购物付款的POS签购单商户名称：古城区胜兴商行， 也没有提供国家要求的正规的购物发票。  商家地址也都没有任何体现，我个人在国家企业信息网上按照购物单位名称，才查找到具体的地址：束河街道茶马驿栈D3-5号。 种种迹象感觉购物被骗，让我对云南之行有些失望。 本想着后续有时间再去旅游体验云南的美景，现在想想还心有余悸。 还希望领导在百忙之中，帮忙协商处理退货事宜，谢谢！,,,
11月10号留言请领导帮助，协助退款已解决,已办理,旅游 感谢,放***,2019-11-1111:37,感谢领导的关心，今天钱已经收到，合壹商号工作人员积极联系我，热情服务，帮助我完成了退款退货，他们店的服务相当到位，真正实现了云南旅游购物的三十天无理由退换，也非常感谢旅游局的同志们，给我打电话做回访，事情已经解决了，麻烦各位了，希望云南越来越好,古城区书记区长信箱,网民同志：您好！      感谢您对我们工作的信任理解与肯定。祝身体健康、生活愉快！,回复时间：2019-11-15 01:24
古城区购买银饰杯子 已解决,待回复,旅游 感谢,z***,2019-11-1110:39,经与店铺售后部门协商，事情已圆满解决，现在货款已退，商品正在寄回中，感谢商行高效的售后，感谢政府监管给力。,,,
请领导帮忙，协助退款,待回复,旅游 求助,放***,2019-11-1108:50,你好，书记，前几天我去丽江度蜜月，11月3号在导游的带领下来到了丽江古城合壹商号，在各种游说下买了两只黄龙玉貔貅，共计4660元，回家之后发现有瑕疵，今天给商号售后打电话，告知公司出了点事，他们休假四五天，让我过段时间再打，我感觉他们是不想退货退款，之前买的时候说云南省承诺30天无理由退换货，请书记帮忙，协助一下尽快退货退款,,,
古城区购买银饰杯子 发现质量问题 要求退货,待回复,旅游 投诉,z***,2019-11-0818:05,尊敬的市委书记：我于2019年10月21日，在丽江古城区农家银饰 购买银杯子2个 ，25号回家后用开水浸泡了一晚上，第二天打开后 杯子底部有很多小黑点，现在与商家协商退货，商家拒绝退货，要求换店内其他商品，现在对于商家店内的商品存在于不放心，麻烦请领导帮忙，谢谢。,,,
古城区无证摊贩臭气熏天,待回复,环保 投诉,忠***,2019-11-0618:29,古城区南门飞马转盘颐养太和北门的新建工地门口有一个摊贩，每天中午12点和下午6点在此刻路段搭帐篷售卖快餐，苍蝇乱飞，卫生条件堪忧，垃圾乱倒，臭气熏天。严重影响周边居民生活，望有关部门处理,,,
 在丽江金茂凯悦酒店退钱事宜已经解决,已办理,旅游 感谢,游***,2019-10-2719:04,10月初在金茂凯悦酒店订房产生的矛盾已经解决了，非常感谢领导的协助帮忙。,古城区书记区长信箱,网民同志：您好！  感谢您对我们工作的信任理解与肯定。祝身体健康、生活愉快！,回复时间：2019-11-15 01:23
迪庆土特产销售药粉,已办理,旅游 投诉,云***,2019-10-2614:55,"2019年10月20日父母跟团旅游至香格里拉古城，被导游带至迪庆土特产店参观，参观期间销售人员得知父母有高血压糖尿病，藏医药销售宣称购买三七、石斛打粉服用可以不用再吃西药，能够治疗病症，被未告知销售价格实际是按照克数销售。老年人文化不高轻信谎言提出购买200元，谁知销售人员称了200克打粉过后才告知是按照克数销售，210克共计2000元，价格远超同类产品10多倍，希望退货退款。土特产销售店“藏医”是否具有相应资质制造、销售“药粉”“治病”
购买产品无商标、无产地、无合格证、无认证信息、无发票，是否为“三无”产品？
再次感谢领导百忙之中查看留言，香格里拉人名热情好客，当地政府也大力推广旅游，此次旅行让老人留下难忘的美好记忆，但是老人自觉被骗心痛不已，希望领导能帮忙解决，还普通老百姓一个公道，一个公平。
",古城区书记区长信箱,网民同志：您好！    您通过人民网《地方领导留言板》给古城区委书记的留言收悉，香格里拉古城不属于丽江市古城区辖区范围，请您向迪庆州香格里拉县相关部门反映，以便得到解决。    祝您身体健康、生活愉快！,回复时间：2019-11-15 01:24
丽江旅游住宿投诉,待回复,旅游 投诉,执***,2019-10-2308:56,"1/ 原住宿丽江如家酒店，想体验民宿，选择了丽江四月花语客栈。2/四月花语客栈电话沟通不让美团下单，并说网上显示有的房间没有，让我们入住另外一个院子(檀悦居)！3/檀悦居客栈，院落小，房间结构差，安全隐患多。4/小孩在房间玩耍，磕碰床沿，下巴缝三针。简单说1/四月花语通过自身营销做口碑，吸引我们下单，并转接我们到别的客栈抽取提成。2/檀悦居品质差，安全隐患多。1/小孩下巴缝三针，在出事过程中，旅店老板毫无作为，居住的檀悦居没有问过任何情况
2/在到医院后，四月花语有礼节性的微信询问，也没有事情处理性建议

个人很气愤！
1/女孩脸上缝三针，是个多严重的事情！！！床垫和床不匹配，这么明显的安全隐患，客栈方没有一点自省？如果撞到眼睛，太阳穴等位置，你让家长怎么办？
2/在民宿出事当做不知道，这是个什么作为？不问问是怎么撞伤的？ 是什么原因撞伤的？这是小事？真要有生死才是大事？


",,,
垃圾乱放，环境污染问题,待回复,环保 投诉,藏***,2019-10-1517:28,古城区香格里苑小区内，经常被陶姓女子，占用公共场合堆满垃圾，严重影响了社区环境，造成周围异味严重，对本人及周边邻居造成极大困扰。适逢建国70周年、丽江创文活动，停车场垃圾已于十一期间被环卫局工作人员强制收走，现此人不再将垃圾堆放至停车场，却改放至我家窗户后！因本人母亲患有冠心病，此女子常在半夜收垃圾，严重影响我们休息，常常一夜难眠！希望领导能高度重视，处罚并杜绝此人污染环境的做法！10月13日警察前来协调此事，此人态度异常嚣张，周围邻居苦不堪言！绿水青山，雪山草地，原本是美好的生活，却因为一颗老鼠屎坏了一锅粥！已经忍受了垃圾堆满 异味满天的日子三年了！恳请相关部门能彻底解决，还我们美丽的生活环境，为丽江创文建设扫清障碍！,,,
关于之前友创商行退货事宜已解决,已办理,旅游 感谢,c***,2019-10-1419:56,经与店铺售后部门协商，事情已圆满解决，现在货品已退！感谢商行高效的售后，感谢政府监管给力。,古城区书记区长信箱,网民同志：您好！  感谢您对我们工作的信任理解与肯定。祝身体健康、生活愉快！,回复时间：2019-10-18 01:24
古城买玉退货事宜已经完美解决，特此感谢政府,待回复,旅游 感谢,雅***,2019-10-1318:22,尊敬的领导：您好！     在此对您表示忠心的感谢，我昨天发贴留言退玉问题得到了圆满的解决，效率非常好而且快。商家是承诺30天退货的，但是有朋友走过类似的经历，物品邮寄过去后最后都财物两空，所以都怕在旅游景点购物。找政府寻求帮助是最好的，在此给云南政府点赞，云南的旅游事业也会越来越好，彩云之南是个美不胜收的好地方。目前我已经收到全额退款到账了。当然我们的导游还是好导游，商家呢还是希望以后越做越好，玉不假，但是价格虚高了些。这样以后我们去云南的游客回来都是对云南赞不绝口。,,,
关于白华生态农贸市场公厕收费,已办理,企业 投诉,旺***,2019-10-1119:12,白华市场公厕收费标准是不是存在问题。人民币支付收费一元、微信支付收费两元。,古城区祥和街道办事处,网民同志：您好！您通过人民网地方领导留言板给古城区委书记的留言收悉，古城区委区政府高度重视，及时责成祥和街道办事处认真调查处理，现将有关情况回复如下：    您反映的问题，我街道工作人员到白华市场进行了解。之前，我街道对辖区公共厕收费情况进行了整治，根据创文办通知要求（取消公共厕所收费），我街道已责令白华市场停止公厕收费。感谢您对我区工作的支持与理解，祝您身体健康、生活愉快！,回复时间：2019-10-18 01:23
在丽江金茂凯悦酒店订了房间不让住也不能退款 ,已办理,旅游 咨询,游***,2019-10-1022:43,10月3日在丽江金茂凯悦臻选酒店订了房间，房费打进酒店支付宝，当晚酒店以查不到预订信息为由不能入住，次日酒店以客人名字在旅游平台有重复预订为由拒绝退款。订了房间不能住也不退款，至今钱还在酒店支付宝账户。真的很无助，我订的可是酒店最贵的门市价，到酒店不能入住了 还不能退款。,古城区市场监督管理局,潘先生/女士：您好！  您通过人民网《地方领导留言板》给古城区委书记的留言收悉，古城区委区政府高度重视，及时责成古城区市场监督管理局认真调查处理，现将有关情况回复如下：经协调，酒店方已妥善处理并退款。11月12日9:30分致电您未接听电话。感谢您对我们工作的支持与理解，祝您身体健康、生活愉快！,回复时间：2019-11-15 01:23
丽江古城区藏金阁珠宝店购买玉价格虚高，想退货,已办理,旅游 投诉,雅***,2019-10-1116:19,尊敬的市委书记：我于2019年10月8日在导游的推荐下，在丽江古城区藏金阁珠宝店买了一块编号为Lp112872价格4280元的黄龙玉佛吊坠，9号回家后懂行的朋友说远不值这个价格，瞬间感觉不好了，因为导游推荐的时候说这个政府扶持的店，就很信任。我现在想把它退了，目前联系了珠宝店的售后，但是又怕财物两空，烦请领导帮忙，谢谢。,古城区市场监督管理局,网民同志：您好！您通过人民网地方领导留言板给古城区委书记的留言收悉，古城区委区政府高度重视，及时责成古城区市场监督管理局认真调查处理，现将有关情况回复如下：    经查，商家已退款退货，10月15日17:09分致电投诉人核实，已收到退款。感谢您对我局工作的支持与理解，祝您身体健康、生活愉快！,回复时间：2019-10-18 01:23
问题已经协商解决,待回复,旅游 感谢,J***,2019-10-0716:42,丽江黄龙玉店家收到信息后立即联系帮我办理的退货处理，反应速度很快，感谢丽江古城区领导 ，在行程当中对导游是满意的，没有强制购物，也感谢导游在退货过程中提供的帮助,,,
问题已经解决,待回复,旅游 感谢,J***,2019-10-0708:28,丽江黄龙玉店家得到消息后立刻联系我帮我办理了退货退款，反应速度很快，感谢丽江古城区的领导，在行程中对丽江的导游是满意的，也没有强制购物，也感谢导游在退货过程中提供的帮助,,,
买黄龙玉受骗,已办理,旅游 投诉,J***,2019-10-0609:33,"书记同志，您好我于20190929在丽江旅行，被导游带到古城区聚德源珠宝店购买黄龙玉手镯一个，价钱是RMB8390,回到深圳水贝做玉多年的朋友看了最多3000元，一路上旅行能够感觉到云南省和丽江市对旅游发展的重视，这种以次充好，坑害游客的现象实在太让人失望，这样严重影响丽江旅游形象一定不是领导们愿意看到的吧，，请书记明察，治理害群之马，也希望我们消费者的权益能够得到正当的保护，谢谢",古城区市场监督管理局,网民同志：您好！您通过人民网地方领导留言板给古城区委书记的留言收悉，古城区委区政府高度重视，及时责成古城区市场监督管理局认真调查处理，现将有关情况回复如下：    经查，商家已退款，10月15日17:07分致电投诉人已收到退款。感谢您对我局工作的支持与理解，祝您身体健康、生活愉快！,回复时间：2019-10-18 01:23
旅游购物被骗，求退款解决,已办理,旅游 投诉,Z***,2019-10-0511:29,2016年8月13日于云南丽江古城区束河路银得天下商城购买S999大师弹跳保健杯1880元，货号501665，现发现保温杯内外无S999等字样，且杯口出现锈迹，对商品真实性存疑，望领导重视且支持商家退款解决！,古城区市场监督管理局,网民同志：您好！您通过人民网地方领导留言板给古城区委书记的留言收悉，古城区委区政府高度重视，及时责成古城区市场监督管理局认真调查处理，现将有关情况回复如下：    您于2016年8月13日购买银杯，由于超过90天无理由退货期及行政处罚追诉时效期，故商家不愿退货；鉴于此，10月15日经联系双方同意换货。    感谢您对我市工作的支持与理解，祝您身体健康、生活愉快！,回复时间：2019-10-18 01:23
丽江古城区所购黃龙玉手镯已退,已办理,旅游 感谢,飞***,2019-09-2715:45,尊敬的领导：您好！            我是哈尔滨游客，之前曾留言请您帮助退掉在丽江古城区藏金阁珠宝店购买的黄龙玉手镯（货号LS101527），没想到今天联系商家，很快就给退款了。我真的很意外，以为退款退货会很难呢，在此向商家表示感谢！向丽江市退换货监理中心表示感谢！以后会继续支持云南的旅游事业，并告知朋友们在云南旅游购物没有后顾之忧！,古城区书记区长信箱,网民同志：您好！  感谢您对我们工作的信任理解与肯定。祝身体健康、生活愉快！,回复时间：2019-09-30 01:23
在丽江古城区所购黄龙玉手镯请求退货,待回复,旅游 投诉,飞***,2019-09-2619:16,尊敬的丽江古城区委书记：您好！我是一名来自黒龙江哈尔滨的游客，2019年9月17日我在丽江古城区藏金阁珠宝店花5580元买了个黄龙玉手镯，货号是LS101527。回到哈尔滨后我上网查了黄龙玉的信息，发现很多去丽江旅游买黄龙玉的人都说价格虚高很多，我心里也不踏实了，就找懂玉石的朋友帮忙评估，结果价格真的虚高很多，我很生气上火，家里人也诸多埋怨，所以恳请领导帮助，让我能顺利退款、退货，万分感谢！,,,
古城区公租房瑞馨佳苑停车困难,待回复,城建 投诉,小***,2019-09-0509:32,1、清理整顿后目前小区停车费按照每晚只要过夜就收10元，但是保安仍然未尽职责、保障小区停车安全，只知道收费，车辆阻塞道路乱停乱放；而且所收费用比如是微信支付进入的是保安私人账户，仍然有看交情收费情况。2、小区门口道路两侧原来有排水沟，现在新建小区的围墙直接修建在路肩上将排水沟填平，雨水无法排除积在道路上严重的脏乱差（请雨天实地查看，惨不忍睹），能否协调新建小区修建排水沟以提高人居环境，谢谢,,,
关于丽江古城区汇鼎商行黄龙玉问题，已经解决,已办理,旅游 感谢,l***,2019-09-0217:16,1.商行客服有及时联系我，并解决退货事宜。澄清了关于汇鼎和江鼎两家商行同属于一家公司，因为听了别人的片面之词，感觉受骗，心急没有跟商家做很好的沟通，直接发帖留言了，寻求领导的帮助。商家目前已经及时处理了退款和退货问题，在此向商家表示歉意，造成了不必要的误会。对于云南的旅游，我后续也会继续支持，告知朋友可以放心自由行。,古城区市场监督管理局,网民同志：您好！  感谢您对我们工作的信任理解与肯定。祝身体健康、生活愉快！,回复时间：2019-09-05 01:23
丽江古城区汇鼎商行黄龙玉感觉被骗，求退货帮助,已办理,旅游 求助,l***,2019-09-0210:37,尊敬的领导您好！我是一名江苏省游客，在2019年8月24日参加的6日5晚云南游来到花城云南，一路感受到云南的文化历史之优美，风景如画，少数民族特色等，这是我在苏州未能感受到的。一路换了3个导游，但是导游也很热情。美中不足的是安排的三次购物行程，其中黄龙玉购物，导游说黄龙玉是云南特色、价格低于翡翠，被称为国玉。旅游购物也是为丽江人民贡献GDP。本人也响应政府拉动当地经济，就购买了一件黄龙玉吊坠貔貅，当时时间比仓促，买完就急匆匆的进入其他行程。隔了两天返回苏州后，有懂行的朋友看了，告知价格虚高很多，有被骗的嫌疑。单价9480的貔貅，成色一般，也就1000多元的价钱。 而且还有个问题，购物付款的POS签购单商户名称：古城区江鼎商行， 而质量保证单的收款单位是：古城区汇鼎商行。  也没有提供国家要求的正规的购物发票。  商家地址也都没有任何体现，我个人在国家企业信息网上按照购物单位名称，才查找到具体的地址，在束河古镇不远，束河街道茶马驿栈D3-5号。 种种迹象感觉购物被骗，让我对云南之行有些失望。 本想着后续有时间再去旅游继续体验云南的美景，现在想想还心有余悸。 这些景区的购物场所，手机信号都很差，当时无法上网查询相关信息。  还希望领导在百忙之中，能帮忙协商处理下退货。 多谢！,古城区市场监督管理局,网民同志：您好！您通过人民网地方领导留言板给古城区委书记的留言收悉，古城区委区政府高度重视，及时责成古城区市场监督管理局认真调查处理，现该问题已得到妥善解决。感谢您对我局工作的支持与理解，祝您身体健康、生活愉快！,回复时间：2019-09-05 01:23
退货反馈,待回复,旅游 感谢,W***,2019-08-2216:22,商家已经办理了退款退货，速度快，态度好，谢谢领导及商家，诚实守信。,,,
足银百福保健杯,待回复,旅游 求助,W***,2019-08-2209:14,我在云南之窗商贸城买会一个价值1980元的百福杯，拿回家后发现即没有含银量标识，也没有重量标识，足银是99.0，根本不能用来做水杯，易换重金属超标。所以我要求退货。,,,
在古城区瑞宝商号买的观音吊有质量问题要求退货,已办理,旅游 求助,孙***,2019-08-1614:43,尊敬的领导您好！我是一名湖北省游客，我与2019年8月6日报的6日游来到我魂牵梦绕的花城云南，一路过来让我感受到云南后文化历史之优美，人文文化之崇高。当地人很好客，风景如画人在画中游之感。导游也很热情。就是美中不足的是一次购物行程，导游说黄龙玉是云南特色、本人抱着游美景购特色，也响应政府拉动经济就买了一件黄龙玉吊坠，在我反程几天的佩戴中发现有诸多裂痕这让人很困惑，当时导游也说了如果任何问题30天包退，希望领导能帮助将此产品退货。,古城区书记区长信箱,网民同志：您好！  您通过人民网《地方领导留言板》给古城区委书记的留言收悉，古城区人民政府高度重视，及时责成相关部门认真调查处理，并进行退货退款。感谢您对我们工作的支持与理解，祝您身体健康、生活愉快！,回复时间：2019-09-03 01:22
泸沽湖官方微信号购票后不能使用且不能退款,已办理,旅游 投诉,m***,2019-08-0714:08,你好 我在泸沽湖官方微信号购买了泸沽湖的门票8张，到现场后被告知不能使用，所以现场购买门票后就在公众号上申请退款。已经两天了，还是没有进程和结果。也无法联系上客服。,古城区书记区长信箱,网民同志：您好！  您通过人民网《地方领导留言板》给古城区委书记的留言收悉，泸沽湖景区属于丽江市宁蒗县行政区划，根据属地管理原则，建议您向宁蒗县委书记留言反映。感谢您对我（省、州、市、县） 工作的支持与理解，祝您身体健康、生活愉快！,回复时间：2019-08-13 01:22
手机号被无故封停,已办理,交通 求助,教***,2019-08-0619:56,您好，本人及家人今年7月29日至8月4日在云南旅游，在去丽江的火车上，手机被封停，山东电信部门让我联系云南反诈骗部门087196110，得知此部门为昆明反诈骗部门，其要求我联系丽江反诈骗088896110，但一直无法接通，由于手机号码无法使用，严重影响到我的工作和生活，再次向书记反应此情况，希望的到回复。谢谢！,丽江市公安局古城分局,网民同志：您好！您通过人民网地方领导留言板给古城区委书记的留言收悉，古城区委区政府高度重视，及时责成丽江市公安局古城分局认真调查处理，现将有关情况回复如下：    经我局对您反映的问题进行核实，您在信访件中提到的“丽江反诈骗088896110”号码不是本单位的联系电话，丽江市公安局古城分局未设置反诈骗专号，我局未接到相关的情况反映。    感谢您对我们工作的支持与理解，祝您身体健康、生活愉快！,回复时间：2019-09-04 01:22
买玉被骗，需要退货,已办理,旅游 投诉,陈***,2019-08-0608:47,我们是朋友推荐去的一家店，是丽江古城里面的，店铺名字叫红翡绿翠，老板名字叫张海鹏，我们在他的介绍下，看上了一对龙凤对牌，一个人手镯还有一个平安扣，一共是48000元，因为有朋友在，没有要发票，但是有支付宝转账记录，老板说龙凤对牌，是店铺十年的宝贝，可是买回来以后我找了好多装门做雕玉的师傅只有一千块左右的东西，根本就值得这个价格，手镯有很多瑕疵，现在老板不同意退货，说不积极，我现在希望尽量退货挽回我的损失,古城区市场监督管理局,网民同志：您好！您通过人民网地方领导留言板给古城区委书记的留言收悉，古城区委区政府高度重视，及时责成古城区市场监督管理局认真调查处理，现将有关情况回复如下：    经核实，本投诉件已由丽江市古城管理局妥善处理。感谢您对我们工作的支持与理解，祝您身体健康、生活愉快！,回复时间：2019-09-04 01:24
之前发帖的晨轩商行黄龙玉退款及时回复解决了,已办理,旅游 感谢,w***,2019-08-0317:25,之前发帖的8月2号晨轩商行购买黄龙玉的事件，商行及时电话回复并解决了，很感谢，本来以为云南这种事情会很难退款，重新刷新了我的认知。,古城区书记区长信箱,网民同志：您好！  感谢您对我们工作的信任理解与肯定。祝身体健康、生活愉快！,回复时间：2019-08-13 01:22
