在泸沽湖买石斛佛手参被骗,待回复,旅游 咨询,飘***,2019-12-0216:56,本人在泸沽湖旅游被导游带到一个卖藏药的地方买药材，购买1300元的石斛和佛手参，还有300元的藏红花，当时卖药的告诉我石斛和佛手参一起可以把糖尿病治好，由于我爱人有这个病出于对导游的信任也就没有多想就买了。后来询问多家药材店这个对糖尿病根本就起不到治疗作用，待到网上查询，有许多朋友都有被骗经历，物品几乎相同，现在发现被骗非常难过，尤其不知道买的是什么东西，肯定不敢给家人吃了，恳请领导帮忙解决一下，万分感谢！,,,
工资拖欠将近一年，要求待业期间工资补偿。,待回复,就业 求助,星***,2019-12-0216:56,尊敬的书记，您好。之前已在大理市领导留言板反映过工资拖欠问题，但过了两个多月也没什么结果，工资拖欠已经将近一年了，无奈只能越级向书记求助，请求书记帮忙解决，谢谢书记！,,,
投诉联联周边游昆明站霸王条款，未消费不退款 ,待回复,企业 投诉,L***,2019-12-0216:39,"本人通过微信联联周边游昆明站，购买电子餐券一份,因个人工作原因,过了2天未能消费,联系客服申请退款,但被驳回。根据国家工商行政管理总局《关于加强网络团购经营活动管理的意见》文件,在“保护消费者合法权益”一栏中指出,“团购网站经营者以预收款方式销售团购商品或服务,不得设定过期未消费预付款不退或者限定款项只能退回网站账户等限制”。联联周边游昆明站设定过期未消费预付款不退的霸王条款不合法，应退全款给我。",,,
学费是普通二本专业的两倍,待回复,教育 咨询,二***,2019-12-0214:55,尊敬的领导，您好       我是云南艺术学院一名普通的大一学生，我们学校是一个普通公办二本艺术学院，有百分之九十九的专业是艺术类专业，所以他们的收费一般都大于普通公办院校，但是我们学校有一个非艺术类专业——文化产业管理，他是一个普通的文化专业，据我所知我们云南开设的学校只有云师大和云艺，我们专业虽是一个普通文化专业，但他的收费确实按照艺术类专业来收费，8500元每年，我觉得这有点欠妥毕竟我们享受的教育资源有所不同，所以我希望省政府能跟据合理的教育资源分配，制定我们专业的收费。谢谢,,,
感谢领导神速维权,待回复,旅游 感谢,邱***,2019-12-0214:39,11月27日在长江第一湾被诱导购药材11200，感谢领导在百忙之中看到我的留言，第二天就联系并退药款，感谢领导办事神速，让我在云南不仅感受到了美丽的风景，还感受到了对民众反映情况的重视和对问题及时处理的方式，在此感谢陈书记以及香格里拉旅游局的工作人员，谢谢您们，下次有机会我一定还会再来云南旅游,,,
2019年云南旅游噩梦,待回复,旅游 投诉,o***,2019-12-0214:32,领导您好。我11月21日参加昆明昆旅国际旅行社 云南之行。11月27日进入西双版纳开始，阿发导游（他要我们叫他阿发，至今不知道导游真名，旅行社也不透露）接待我们之后简直是噩梦。首先第一天告诉我们要自费370元套餐票参加夜游湄公河，不参加就在车下面等三个小时，再告诉我们不参加的，西双版纳晚上蚊子多（变相威胁），被咬就会得登革热疾病。第二天下午我不参加夜游湄公河，问阿发酒店位置，他说要游完湄公河才知道我联系了旅行社，旅行社告知了我酒店位置。阿发知道此事后，在车上骂我，各种脏话语言攻击，还威胁我小心点，有一千种办法对付我，全车团员可以作证！车牌号为 云GY8333.（ 阿发导游接待时间段为2019年11月27日早上七点—11月28日下午七点）。我感觉生命财产安全得不到保障，与旅行社沟通后，11月29日早上直接自费飞往昆明。短短两天时间，接待态度恶劣，服务缩水，根本达不到一名导游的标准， 旅游大巴车牌号为 云GY8333车辆内置摄像头录像，相关负责回应此次投诉的领导可以调阅。我们花正常的团费出来欣赏云南的美景，为什么受到如此接待！现在扫黑除恶，希望领导严肃处理，本人没有其他诉求，只为正义！,,,
云南省昭通市永善县务基镇捏池村星光三社滑坡,待回复,政务 求助,卢***,2019-12-0214:05,我是云南省昭通市永善县务基镇捏池村星光三社村民，要向陈豪书记反映我们社受三峡电站影响的滑坡，2013年发生的现在2019年了还没给我们解决，现在整整6年了我们没房住，没有地做，政府和三峡公司把我们追出来6年了没给我们一个说法，可以想一下我们这6年是怎么过的，现在全村居无定所，而且去问有关部门还说我们村脱贫了，请书记都促有关部门尽快给我们解决，我们这6年过够了这居无定所的苦日孑了,,,
希望组织、人社公平基层项目政策,待回复,就业 建言,陈***,2019-12-0214:05,尊敬的陈书记：您好，我想向您以及组织部、人社部门反映一下，关于云南省四项目人员期满政策待遇严重不公平的现象。2017年1月24日，中共中央办公厅、国务院办公厅印发了《关于进一步引导和鼓励高校毕业生到基层工作的意见》(中办发〔2016〕79号)文件，云南地区根据中央文件精神，对大学生村官、三支一扶等项目人员出台了一系列服务期满扎根当地政策，唯独“忽略”了大学生西部志愿者，造成了项目间政策严重失衡，与中央与云南文件中明确提出“促进项目间政策协调平衡”的精神不符。第一，大学生村官政策矛盾尤为突出。自2017年起，云南省开始单独设立了大学生村官的公务员定向岗、事业单位定向岗，并且大学生村官兜底事业编制。村官的公务员定向岗和事业单位定向岗占了大量的编制资源，本就是造成了政策天平的严重失衡，可还有更奇怪的事，好的政策反而造成了恶劣的影响。部分大学生村官反而挑肥拣瘦，在事业单位定向岗位考试中，故意不做、甚至故意做错，以求低分，（100分的题考1.8分？）坐等公务员的单独定向岗位。好的政策并没有起到良性效果，反而以低分为荣。第二，三支一扶、特岗教师服务期满政策“通吃”。三支一扶、特岗教师服务期满转事业编制的同时，仍然延续2010年出台的定向岗政策，既可转编同时还参与定向岗位，更是造成了西部志愿者差距持续扩大。与此相反，本就没有出台任何新的扎根当地政策的西部志愿者群体。与大学生村官、三支一扶同志甚至在同一间办公室工作，却亲身体会了部分大学生村官对于仅面向他们的事业单位定向位的不屑。政策的不公平性在同一间办公室展现的淋漓尽致。希望陈书记、组织部、人社部门领导能进一步调察、核实情况，由本部门主管项目的角度切换到基层项目全局的角度，充分考虑项目间政策协调平衡，出台公平、合理的基层项目期满政策。附图：大学生村官事业定向成绩表（各地同样情况）,,,
云南省宣威市振兴北路市政府画线收费,待回复,城建 咨询,y***,2019-12-0213:49,尊敬的陈书记你好！       我是云南省宣威市振兴北路12_13的业主，我们的住房是自建房，审批的时候街道连着街道路面卖给了我们，建房时路面，人行横道都是我们的建筑面积里退让出来的，现在宣威市政府画出停车位开始有偿收费，前半个小时免费，半个小时以后每小时收费3元，每天早上8:30_晚上8:30是收费时间，一天12个小时，每天的停车费是12小时×3元=36元，每天36元×30天=1080元，每个月1080元×12个月=12960元，每年12960元的停车费，陈书记我们停不起，有偿收费我们没有意见，但是街道都是公摊面积是我们建房的使用面积里让出去的，首先是我们出钱买过的，就算要收费也应该给我们一个停车位使用吧？车辆每年都在贬值，两年的停车费就够买一辆车了，陈书记昆明的停车收费也会根据街道给临街住户一个免费的停车位，宣威为何没有，停车费还这么贵？陈书记能请你帮我们解决嘛？,,,
请支付我血汗钱,待回复,城建 求助,成***,2019-12-0213:45,"领导你好，我叫陈发配，家住云南省宣威市乐丰乡建文村委会腊吉村，是建档立卡贫困户，我今年6,7,8,月份在镇雄连租房和建投八公司,做的外墙刮白灰工钱至今没有支付我，工资一共12615元 ,支付3500元，下欠9115元，多次给老板讨要没有结果，希望领导能帮助我讨回我的血汗钱，",,,
黑心开发商销售无产权车位,待回复,城建 投诉,G***,2019-12-0213:43,我是云南西双版纳景洪市易武路6号的业主，西双版纳盛泰房地产开发商公然发布销售【无产权】的停车位公告，直言不买车位不能停车，这是强买强卖。请求政府出手，严查开发商违法销售车位的行为。万分感谢。,,,
一分钱不给把我挖机强占,待回复,城建 求助,W***,2019-12-0211:23,尊敬的陈书记您好!希望你在百忙之中能看到我的留言、帮我讨回公道。我家住昆明市嵩明县杨桥乡月家村委会大梨花村455号。2018年6月1日我将一台卡特挖机租给司彦超在广南者兔乡修乡村路、在使用过程中土石方跨踏导致挖机严重受损、经乡政府调解双方未达成协议、之后司彦超强买强卖说把我挖机卖给他、我也没办法答应卖给他、说一星期、两星期付钱给我一直到现在也未付一分钱给我、现在把我挖机强行占为已有、把我挖机当成他自已的在干活。一分钱不给我、这种强买强卖行为我该怎么办?,,,
宣威市落水镇鑫丰养殖场请求给予用地申批,待回复,三农 求助,丢***,2019-12-0211:14,宣威市落水镇鑫丰养殖场始建于2010年，建设用地属于一般耕地，位于珠江源自然保护区边缘，非核心区和缓冲区，本人多次向土管林业部门申请用地审批，林业部门以在珠江源自然保护区范围内不予办证为由多次拒绝，而同属于一个范围内的德康希望集团多家养殖场能够申请用地申批，敬请领导给予关注帮助为谢。,,,
第五届云南省互联网+大学生创新创业大赛,待回复,教育 咨询,挥***,2019-12-0211:11,尊敬的领导，您好！我们的创业团队于今年七月初参加完省赛，十一月中旬老师向我们核对了获奖名单。从参加完比赛至今已经快半年了，请问这个奖状何时可以发放？谢谢！,,,
天然气初装费,待回复,城建 投诉,E***,2019-12-0210:50,尊敬的李书记，您好！我于2018年9月购买了一套商品房，在今年2019年11月30号交房时要求缴纳天然气初装费2700元，缴纳完所有费用才可领到钥匙接房，但我查阅了相关资料，已了解相关信息，我看文件是从2017年6月20日起就开始不向燃气用户收取，而是向开发商统一收取，而且规定也是从2019年1月1日起开始执行。我想请教一下这个费用到底要不要缴纳,,,
身份信息无故被有案底，改向哪个部门反应,待回复,政务 求助,W***,2019-12-0210:44,  我哥刘X奎，家住云南省昭通市鲁甸县龙头山镇，这些年来，一直在昆明上班！但是最近街上查身份证的民警一查身份证就被告知他有案底！这些日子跑过好些地方公安局派出所！但是问题都得不到解决！要们就不告知具体情况要们就说他们管不了！这一问题不知道要怎么才能得到解决！该找什么部门才能解决,,,
（我是个孤儿望政府领导能帮我解决住房问题）,待回复,城建 求助,W***,2019-12-0210:44,尊敬的政府领导我叫季XX，男，汉族。出生于1997年11月10日。昭通市昭阳区北闸镇人。很小的时候家住昭阳区北闸镇北闸村民委员会12组62号。电话:18550841xx :我是北闸村的村民，现在我有4口人。在我三岁的时候就失去了父母变成了孤儿。母亲由于生病去世了。后来父亲离家之后再也了无音讯至今未归。我也就变成了无人管无人问的孤儿，后来我爷爷才把我接到了他的老家，好不容易有了个家，可是当时爷爷家的条件也不好，没过几年爷爷又生病去世了。爷爷去世后我再次失去了家，没办法当时人也还小，连吃的都没有，都是隔壁邻居的大叔大爹家看我可怜。这家给点吃的那家给点吃的吃百家饭长大。就这样以此为据到了我13岁多一点，实在被逼无奈，我出去打童工维持自己的生活，现在想起以前的生活心里就会发酸，一个人无依无靠无人管无人问，一路走到今天，连我自己都不知道自己是怎么过来的。我现在也长大了 也有了妻儿。就想回到我的老家北闸镇。当我回去之后发现家里的土地以及老房子都被亲戚给霸占光给变卖光了。连建房地基都没有。变成孤儿离家时才三岁。我现在连一个最基本的遮风避雨的地方都没有，这些年四处奔波也有几万的积蓄，于是我向北闸镇人民政府提出了异地建房申请。没办法我外公后来给了我一点建设用地让我去修建房子。经过北闸镇三个部门领导综合考虑我的情况准许我建房，相关手续全部办全后我就开始建房。建房地点在大龙洞情未了山庄旁边，刚把第一层修好，昭阳区太平社区就给我下了一个违章建筑通知要求我自行拆除房屋。说我所修建的土地是太平镇的管辖范围。我当时一头雾水，不知道是什么原因，我所有的建房手续都是齐全的，是北闸镇人民政府准建的，为什么就不准修建呢？如果真的拆除了我这几年积攒的血汗全全部都投在了建房上面。我不知接下来我应该何去何从。如果拆除了这个损失谁来替我承担？妻儿现在连遮风挡雨的地方都没有。后来北闸镇的领导又去和太平镇的领导协商让我继续修建下去，结果第二层刚刚把模支好之后又不准许我建房了，前前后后加起来拖了两个多月现在还没有得到解决。现在冬天外面下着雪，而我和我的妻儿们住在一个塑料小棚子里。我不贪心我只想有个家。国家要求全民脱贫，我这算是脱贫了吗？请求各级相关政府领导根据我的实际情况调查此事。请求各级政府领导解决我住房问题。以上说明全部属实，如有造谣我愿意承担法律责任,,,
手机号被封停需要邮寄哪些材料,待回复,治安 求助,飘***,2019-12-0210:33,你好，尊敬的书记，以及领导。本人八月份路过云南，顺便旅游一下，结果手机号被封停电话号码是1389566✘✘✘✘。通过留言，看到需要我本人邮寄材料配合解封，请问需要我本人邮寄哪些材料到景洪反诈中心。我寄过去。那段时间，心情不好，路过云南本想多旅游一段时间，本想散散心，再彝人古镇住了两天客栈，结果手机号被封停。由于打不通电话，所以选择了网上留言。我从小到大一直都尊纪守法，做人比较本分。一直做美容行业。也许是误封了，希望近早配合领导调查解封手机号。那个手机号用了十几年。也绑定了很多银行卡。希望能早日解封。过年的时候，还想带妈妈去云南旅游，又怕手机号被封了。谢谢领导们的回复，盼回复。,,,
曲靖恒大绿洲小区减配建设且收取高物业费,待回复,城建 求助,一***,2019-12-0210:15,"书记您好：非常感谢您百忙之中看我的留言，情况是这样的：我购买了曲靖恒大绿洲小区住房一套，该项目为恒大集团云南公司子公司曲靖恒工达置业有限公司开发建设，开发商宣传规划设计承诺为曲靖高档住宅小区,封闭式人车分流，配置中高端大门，但如今一期交房在即，开发商并未恪守初衷规划设计方案，将小区大门减配不建，只留一座小岗亭，且收取高于政府定价标准的物业费，完全不顾及购房者的利益，当时花了全家积蓄，只为买高品质住宅，却获得这样的结果。我也向恒大客服投诉了，但他们始终推诿敷衍说当时规划就没有大门，今实属无奈，恳请书记明察，忠心的表示感谢！",,,
西双版纳电信诈骗，反诈中心,待回复,治安 投诉,陕***,2019-12-0210:14,手机号码无故被云南反诈骗中心停机，起初以为卡坏了，联系营业厅说是被停机，给了一个反诈骗中心的电话号码  ，打了两天一直占线，也联系不到任何部门，诉说无门。该号码绑定了微信，支付宝，银行卡，因为手机停机使用很麻烦。本人号码用了十年，没发过垃圾短信和骚扰电话，到西双版纳玩的第二天就被停机了，烦请陈书记费心帮忙联系公安机关 告诉我解除封禁的流程 手续！ 如有打扰 实属无奈！万望理解！11月19号出国去斯里兰卡玩了十天，11月29号回国下飞机回家途中还好好的，11月30号手机莫名停机了，无法和家人取得联系，打电话给10086，被告知手机号是公安局给停机了，并给了一个西双版纳的电话让我去联系，但是拨打了两天这个电话，打了很多次，不是占线就是无人接听。该手机号我已使用了十多年，从未发过垃圾短信和骚扰电话。现在因停机给我生活带来了很大的困扰，该号码绑定了银行卡，但是现在我无法收到短信验证或提醒，无法使用。我本次未去西双版纳，不知为何将我手机号停了，我现在是诉说无门，烦请陈书记费心，帮忙联系下公安机关，告诉我个解封的手续，谢谢。如有打扰，实属无奈，望理解，求加急！,,,
注册手机被临沧警方封停 求解无门,待回复,治安 感谢,Q***,2019-12-0210:14,我是25日上传，26日显示上述留言。29日经省反诈骗中心处理。高效率解决了问题。在此感谢云南省领导，感谢经办的同志。感谢省反诈中心的警官，谢谢。,,,
云南旅行，电话被封,待回复,三农 求助,社***,2019-12-0209:46,本人于11月30日前往云南旅行，无任何不良信息，用了20年的电话号码被无故封停，导致现在生活受到极大影响，希望有关部门可以解决，谢谢。,,,
新修道路完善市政基础设施,待回复,城建 建言,W***,2019-12-0209:46,昆明市西山区前卫街道广福城沁福园小区与未名城小区中间的一条市政道路多年没有修建，被广福城沁福园物业做为建筑垃圾的堆放场地，不仅影响小区居民出行而且影响环境。诉求：1.尽快修通道路，2.责令小区物业清除建筑垃圾，不要违规占用市政道路。,,,
小区楼下变成了弃渣场,待回复,环保 建言,W***,2019-12-0209:46,昆明市西山区前卫街道广福城沁福园小区交房已经4年多，但是楼下一直堆放建筑垃圾。小区变成了弃土场！！！,,,
老旧小区交地方却不负责任,待回复,城建 求助,静***,2019-12-0209:22,尊敬的陈豪书记：       我们是一群居住在红河州开远市泸江铁路一区的退休老工人，一直在这里与世无争，颐养天年。所居住的小区已有20多年的历史，因此小区房屋内的卫生间和厨房的下水道的铁管网年久失修，很多都出现了破裂渗露的情况。小区原来属于昆明铁路局管理，前两年更换了小区部分住户的下水管网，还有大部分住户未更换，当时说是会逐步全部更换。现在小区突然要交地方管理却只修缮房屋外的公共地方，房屋内群众最关因的下水道更换问题却没人处理，我们也向上级部门反应了，可没人理睬我们这些退休的老人。希望陈书记能够看到我们的留言，关心一下我们这群也曾为这个国家辛勤工作过的退休老职工的困苦生活。,,,
瑞丽黄氏夫人珠宝旗舰店销售欺诈,待回复,企业 投诉,黄***,2019-12-0208:55,尊敬的领导！本人于2019年8月23日到9月2日在淘宝黄氏夫人珠宝旗舰店直播间里购买6块翡翠开窗原石。本人考虑是否购买翡翠原石时黄氏主播人员在直播间里经常夸张翡翠原石开窗部位的价格，说开窗位置一个戒面或一个牌子就能回本其他位置都是而外送的，在其夸张销售话语及不符真实翡翠原石情况下购买。翡翠原石收到后，发现实际颜色、打灯效果等与直播间里面有严重的区别，希望能退货退款429200元由于淘宝客服的失误导致淘宝关闭了维权通道，他们也没办法给到我帮助及处理，所以才会在这里需求帮助及维权！望领导能帮助我这些弱势群体，对不良商家进行有效的处理！,,,
云南省企业思想政治工作人员专业职务还会评吗？,待回复,政务 咨询,k***,2019-12-0208:55,尊敬的书记您好，我连续两年申报昆明市高级经济师，论文、工作经历各方面都够的，但都没过，咨询有关部门，说是我从事企业党建工作，跟经济关系不大，建议申报政工系列，但我查了一下，貌似这几年都没有渠道来申报政工专业了，而其他省一直在评，中央到地方一直重视企业党建工作，重视党务人员的培养，我们也希望有一个进步的渠道，想咨询一下，云南省哪里可以申报，如果暂时没有渠道，未来会考虑吗？谢谢,,,
你好，我在你们当地买的药材三七被骗,待回复,旅游 求助,梁***,2019-12-0208:20,你好，陈豪书记，我在狜古宗古城买三七时，当时卖三七的人把生长一年的三七骗我说是野生的三七，当时购买了500元，回到丽江时才发现是假的,,,
大病救助,待回复,医疗 求助,7***,2019-12-0208:17,今年9月我妈确诊恶性黑色素肿瘤，因为每个月费用基本在3万左右。我们农村家庭承受不了，想申请大病救助和低保。去当地社保局说不属于救助。麻烦给我们看看能不能申请。（一年收入2万）,,,
 关于国有企业改制下岗职工 福利住房确权请求  ,待回复,企业 咨询,苦***,2019-12-0208:17,尊敬的领导：        我们是原玉溪市峨山县化念糖纸总厂国有企业下岗职工，于2000年9月改制下岗，职工住房未按当时国家政策进行房改，为此玉溪市委领导（米东升）和县委领导（巴玉发）等领导，为安置下岗职工住房，在峨山县委会堂郑重承诺化念魁阁山小区住房为职工福利房分配给下岗职工（会议记录可查），2019年7月30日，峨山国有资产监督管理委员会突然发布公告，限我们于2019年9月30日前无条件搬出，无视下岗职工的合法权益，对于产权归属不做任何解释。                2019年11月15日峨山县国有资产经营有限公司多次发布公告，限期我们无条件清退房屋，现已强行停水，停电， 我们下岗职工强烈要求政府主管部门公示魁阁山小区福利房产权归属，望各位领导给予下岗职工一个公平、公正、公开的处理意见，静候佳音。   ,,,
领导你好，去云南玩了几天，手机号无故停机,待回复,文娱 求助,周***,2019-12-0207:59,领导你好，我手机号十一月份去云南玩了几天，去的那天跟西双版纳的几个号码通过电话，晚上就被停机，等我回到合肥，去营业厅查询，是被你们069196110停机的，打你们的电话从来没有打通过，希望领导能帮我解决,,,
俩张电信手机号被封,待回复,旅游 咨询,怀***,2019-12-0207:59,尊敬的领导:       公司派我到云南临沧这边出差，一进入临沧市手机号码就被封，手机号码我用了三四年。现在公司那边联系不上我，我手机号码绑定了银行卡，支付宝，微信等，电话打不通也打不进来，信息也收不到。望各位领导帮忙解决，如需资料和其他证明麻烦告知，我愿意带齐资料证件到相关部门协助解决。麻烦各位领导实属无奈，望各位领导见谅。                                                      ,,,
手机被无故停机,待回复,治安 求助,f***,2019-12-0207:59,尊敬的陈书记，我是上海援滇医疗队的一名普通医务人员，本月底刚刚进入云南保山龙陵工作，昨天手机被无故停机，致电10086说是被云南警方停机的，他们无法处理，让联系云南警方，警方电话一直未能接通，手机停机给工作带来极大不便，望请陈书记帮忙解决，谢谢,,,
