两年还不付农民工工资,待回复,交通 求助,皮***,2019-11-2815:46,尊敬的陈豪书记您好！我是在普洱市西盟县2018年村组道路，其中一个施工班组负责人，我求助于西盟村组道路烂尾一事！请求陈书记为我们主持公道！在2018年2月份参加了这个项目的施工，自己还交了130万保证金，也没有退回，在施工中完成了400多万工程量，交通局已经足额拨付给中交建宏峰集团，公司杨*虚开增值税发票、伪造机械合同套取资金和挪用，不支付农民工工资和工程款，一年可以完成路修了两年，小康路变成烂尾路，此项目高价中标低价转包给施工队，而且还不让我们说，谁说就不客气，望书记叫人清查此项目的灰色事件！也让好政策真正落实给老百姓走上脱贫小康路，民生问题不在民怨四起，波级各个部门！望陈书记能在百忙之中洞悉民生之声！谢谢！,,,
江川县大街镇至路居镇道路破烂求助维修,待回复,交通 求助,居***,2019-11-2815:46,陈书记：江川县大街镇至路居镇道路破烂好几年了，这条路是链接县城和路居镇的交通要道，涉及路两边几万人的交通出行，但近几年道路破损严重，灰尘太大，行驶条件很差，导致人民出行不便，希望有关部门尽快维修这条路，让人们方便出行，有路可行！谢谢！,,,
香格里拉长江第一峡药托购药,待回复,旅游 投诉,邱***,2019-11-2815:46,尊敬的云南省委陈书记您好，我带着三位老人来到美丽的香格里拉旅游，在长江第一峡参观时看到二楼卖药材的，然后有对夫妇说是医生说这些药材不错对老人挺好，当时也觉得云南是个纯朴的民族，没想那么多，然后就买了冬虫夏草，天麻，壮阳草，共计11298，实收了11200，买了后听到朋友告诉我上当了，然后上网查了下觉得应该是药托，当时叫我们打粉不会损耗，一算帐11298，请书记帮忙退款，本来对这很好的印象别让我们下次不敢来了谢谢希望领导严查让大家不要怕来云南，这样严重影响了对云南的印象，而且本来是想买来孝顺老人，被骗了心情很不好，希望领导可以帮忙退货退款，-谢谢了,,,
昆明土地公公科技有限公司工资以结清,待回复,就业 感谢,M***,2019-11-2815:46,非常感谢！陈书记的帮忙，及各位领导的帮忙，公司拖欠我的工作以全部结清，忘成书记这边能把我之前写的公司拖欠员工工资留言给予删除，在此申请，感谢陈书记，非常感谢！谢谢。,,,
昆钢新区脱硫脱硝项目拖欠大量农民工工资,待回复,就业 求助,小***,2019-11-2815:38,书记您好，我是一个农民工，去年8月我参与了安宁市草埔镇昆钢新区脱硫脱硝项目的的建设（内外墙装饰班组），建设单位是昆钢下属天朗环保集团，总承包公司是昆钢建设集团下属的昆钢机制公司，去年11月份就已经完工，到现在1年多时间了，我和10多个农民工兄弟只拿到了20%（11万）的工程款，我们老板邹**现在已经联系不上，昆钢机制公司也对我们说他们无能为力，他们已经把钱付给我们老板，我们找过安宁市劳动监察大队，对方也是让我们去找我们老板以及昆钢机制公司，我们现在讨薪无门，眼看马上就快要过年了，请求领导能帮帮我们。,,,
禄劝县云龙乡联合村委会双坝村搬迁问题,待回复,三农 求助,z***,2019-11-2815:38,陈书记您好！         我是昆明市禄劝县云龙乡联合村委会双坝村村民。云龙乡属于重点水源保护区。周围离水源去比较近的村民都搬迁了，就连比我们村离得远的东瓜河村都搬迁了，唯独我们村没搬迁。而且我们村田地也有被水淹的，但是没有得到任何赔偿，并且我们村民还发现在禄劝县移民局的搬迁规划图里有我们村的名字，但是我们村依然还在原地，希望陈书记也能帮解决一下问题，因为我们村完全符合搬迁条件。,,,
拖欠盈江姐门公路及南英公路工程款,待回复,交通 求助,W***,2019-11-2815:38,自17年全垫资为云南正昌建筑有我限公司施工姐门公路、南英公路的桥梁工程至当年11月份竣工。至今天19年底没有收到一分钱工程款。经正昌公司那里得知是盈江县交通局未拔工程款到正昌公司故没法支付我方工程款130多万，现我方资金紧缺急需收回欠款支付工人工资及材料费。望上级领导给予帮助督促盈江县交通局及时支付工程款,,,
云南建投集团第六建设有限公司“建投锦城”,待回复,城建 求助,大***,2019-11-2815:34,领导您好，我是建投集团的一名基层员工，16年底建投六公司在集团内部宣传有福利房，然后我就去交了十万的意向金认购了一套111平方的房子，当时六公司给出的承诺是有房产证，能贷款，预计18年11月底交房，但一直到现在都没有交房，也不向我们披露下工程进度，打电话去就是各种搪塞，一直到现在还是没有关于房子的任何官方信息，上次组织我们开了一次会，他们给我们的讯息就是“我们很努力，你们等消息”。当时我们交钱的时候，周边房价大概在4500左右，但是现在“建投锦城”周边的房价都是一万以上，我实在是没办法了，我为了等房子结婚，已经拖延了两年了，即使结婚了，我也不敢领结婚证，因为当时说的是，我们必须是单身且无房才有资格购买，身为建投的职工，我们是很相信集团的，但是一直以来，希望越大，失望越大，我一个外出打工的年轻人，只想在省城有一个落脚的地方，现在房价那么高，这是我唯一的希望，请不要让它成为压死骆驼的最后一根稻草，我们一起签订了购房意向金的人大概有四百多个，都是一样的奋斗在项目一线的基层职工，我们一起参建了很多棚户区改造、移民搬迁、保障房等，但我们却没有一套属于自己的住房。在这里，我也恳求领导，帮我们解决一下住房问题，万分感谢！,,,
关于建投六公司大石坝棚户改造项目的求助,待回复,城建 求助,x***,2019-11-2815:34,领导您好，我是云南建投六公司大石坝棚户改造区购房者中的一员，2016年交了10万的购房意向金给建投六公司，按照合同约定2018年年底交房，现在三年过去了，房子已经建好，但是还迟迟没有接到六公司交房的任何信息。购房人员打电话询问，六公司也是以等通知为由推诿。实在找不到更好的解决办法，故求助于领导。,,,
关于云南建投六公司大石棚改造项目,待回复,城建 求助,小***,2019-11-2815:34,领导您好，我是建投二级公司的一名职工，15年参加工作，16年建投合并，公司宣传有建投锦城这个房子，说是职工内部福利，当时昆明的房价也还有没现在这么高，当时宣传的是3600多到3800多每平方，当时购房要求是公司职工，未享受过福利住房，现在听说又要弄成经济适用房，像我们这种还没到30岁，也还没结婚的是不是就不能买了。而且又要交全款，又要涨价的，当时我们买其他的房子也是买得起的，现在弄得一无所有了。六公司给我们的回复永远是政府这里怎么样怎么样的，我能理解政府工作多，压力大。但我们平民百姓真的没有做错什么，我们本本分分工作，作为90后，没有房子我们这一代人遇到的最难的问题。我们真的只想本本分分工作，有一个家，找一个对象。还希望领导能为我们做做主。,,,
云南建投锦城不交房的原因,待回复,城建 求助,流***,2019-11-2815:12,陈书记您好，我是13年11月来的建投工作的，截止今天已经6年零28天，16年中旬建投宣传大石坝棚改建投锦城项目，当时宣传时说18年交房，截止今天已经1年多杳无音信，迟迟不交房，当时东拼西凑交了10万元的购房意向金，18年来一直盼啊盼等着交房，房子已经建好，看得到摸得到就是住不进去，麻烦陈书记帮我们解决一下是什么原因一直不交房？何时能交房？现在购房者都在关心这个问题，因为买这房的几乎都是低收入人群，都等着房子去入住，麻烦书记看到回复下，谢谢书记。,,,
云南建投锦城延期建房开发公司不闻不问,待回复,城建 求助,q***,2019-11-2815:12,我是建投的一名员工，16年购房意向金交了后，一直期待交房，纸巾2019年已经过完，没有任何进展，打电话问咨询，一直以不知道，等通知为由拒绝通话，希望领导查证一下迟迟不交房的原因。谢谢,,,
昆明垠创房地产开发有限公司拒绝履行退房款事件,待回复,城建 投诉,空***,2019-11-2815:08,昆明垠创房地产公司拒绝履行退我购房款合计36.7037万元。恳求领导给予帮助，协调昆明垠创房地产公司尽快归还欠款。,,,
旅游时手机被无故封号,待回复,旅游 求助,刘***,2019-11-2814:21,本人11月7号和两个朋友到临沧旅游，起初以为卡坏了后联系10086移动说是被停机，手机号码无故被云南反诈骗中心停机，给了一个反诈骗中心的电话号码 088396110，打了几天一直占线，本人号码用了十几年实名 绑定了支付宝银行卡很多信息，从没发过垃圾短信和骚扰电话，现无法接收验证码及正常使用已经严重影响到了旅游行程，望领导重视。谢谢。,,,
翡翠退货得到解决 感谢快速对应！,待回复,旅游 感谢,R***,2019-11-2813:56,尊敬的陈书记您好!之前因在旅游时购买翡翠在您这里寻求帮助，因已超过30天无理由退换货期限，所以才留言寻求帮助。感谢陈书记在百忙之中为我处理，经上级领导和公司负责人协商已给我处理退货事宜! 在此对商家的负面影响表示歉意，感谢政府，感谢领导，祝云南越来越好。,,,
农民工,待回复,交通 求助,包***,2019-11-2813:43,尊敬的陈豪书记您好！我是普洱西盟县2018年村组公路工作的农民工包*从2018年至2019年2月份，就拿到1000元工资，因为小包工头拿不到钱，也卖了房子，请书记为我们这些弱势群体主持公道！把钱拨给包工头，也让我们和家人一起吃团圆饭，过安稳年！,,,
中移动手机号码无端被停,待回复,治安 求助,半***,2019-11-2813:29,本人实名制办理的中国移动号码无端被停，余额充足，但是不可拨打电话，不能接入数据网络上网。已多次联系中移动10086、10080等部门，答案是号码存在违规操作，开机申请至今未果……但相关移动资费套餐仍在扣费中，而我却享受不到服务。移动号码平时电话短信少，具体可查询到通讯记录，望相关部门尽快给予办理恢复网络业务。在此，劳烦到陈书记，还请谅解。,,,
13552766992手机被强制停机,待回复,治安 求助,冯***,2019-11-2813:29,领导您好，我是冯XX135XXXX6992的机主，21号早上突然发现135XXXX6992手机被停机了，打了10086告知我是被云南警方强制停机的，我是来瑞丽出差，手机号已经用了12年多，对我非常重要，我的家人/领导/朋友/客户都知道我的这个手机号，无缘无辜的被停机，这几天给我造成的很大的麻烦。21号停机以后我就去了当地派出所备案，当地警察告诉我2--3天就会解开，但是我在当地一等就是一周，最后告诉我只能等着。移动公司给了我一个电话0871-63054338让我打，我这一打就是一周，要不就是忙，要不就是通了没人接。这个电话号码对我非常重要，我和家人客户朋友沟通都得需要这个电话，还有好多APP的信息都接收不到，对我的生活带来很大的不便，还望领导视察。,,,
宣威凤凰山基地主干道建设指挥部拖欠工程款,待回复,城建 求助,小***,2019-11-2813:25,"        宣威凤凰山循环经济园区主干道工程第二标段于2007年3月18日完成招投标工作,2007年4月2日确定湖南省第六工程有公司（乙方）中标,中标价5593765.97元，工期150日历天。2011年1月21日与宣威凤凰山基地主干道建设指挥部(甲方)签订“建设工程施工合同”,约定合同价款为:5902296.04元，合同约定开工日期为2011年2月18日,竣工日期为2011年7月18日,我单位在合同约定的工期内按质按量完成了全部工程内容, 并按合同约定报送竣工结算书至建设单位进行竣工结算,经过与建设单位及其他参建单位的多次沟通协调,该项目于2016年7月15日完成竣工结算审计,审定工程造价:6370856.89元，根据审计报告及施工过程的拨付款记录,截至2018年3月19日止,建设单位已拨付工程款: 5640000.00元，甲方应按双方签订的“建设工程施工合同”的相关规定与乙方结清工程款,但至今甲方仍拖欠乙方工程款730856.89元。        本项目自招投标建设至今长达十年之久，经过与甲方多次催要、 协调无果，特向陈书记求助，责令甲方偿付乙方剩余工程款为谢。",,,
手机号码被反诈中心封停反馈,待回复,治安 求助,l***,2019-11-2813:25,陈书记，您好！我一使用的手机号，于11月26日被反诈骗中心封停，当天我在宁夏银川市金凤区，于11月27日打电话发现电话暂停服务，打电信公司电话咨询说被反诈中心封停了，该手机号码无法正常接打电话，收发短信！现已严重影响个人生活与工作，联系当地公安局，一个反诈骗中心的电话号码069196110，打了两天一直占线，也联系不到任何部门，诉说无门。该公司号码我已使用近3年，均为正常工作性质使用，没发过垃短信和騷扰电话，请陈书记费心帮忙联系公安机关告诉我解除封禁的流程手续!』如有打扰，还望见谅。本人未出境，本人也未去过云南，且承诺没有涉及及参与任何违法乱纪事宜，请相关同志核查并帮助解封。谢谢。,,,
昆明呈贡区广电苑义园护栏设计存在较大安全隐患,待回复,城建 求助,一***,2019-11-2809:24,本人为呈贡区广电苑义园住户，接房时发现该组团房子高30余层，每家（5户）门口护栏高约1.5米左右，上方约有长1—3米不等、高1.5米的空白区域，无其他防护措施，存在重大安全隐患（与其他住户交流时反映，之前有租客搬家时，一男童不慎从该空白处坠楼身亡）。有鉴于此，我曾几次向物管反映，均表示无法解决。后向市长热线反馈，告知我该设计符合国家相关规定。对此，我认可该空白区域符合规定，是合法合规，但于情于理不合，毕竟是让大家24小时置于坠楼的可能性上。可否在合法合规的基础上，充分考虑广大住户的生命财产安全，敦促相关部门加以改进（加高防护栏、加装防护网等），也是真正解决群众最急最盼的务实之举。,,,
拖欠工资款五年，至今未果,待回复,企业 求助,李***,2019-11-2808:44,"尊敬的陈书记：                 您好，本人李**，四川宜宾人，全国一级建造师。2013年8月至2014年5月初承包云南文山硕峰房产公司新天地二期工程，近九个月，共计投入二千余万元之多，可万**为首利益集团一直未按合同付款，并对本人二千余万元投入进行了抢夺霸占，并将我本人赶出文山市。四年有余，期间身心受到及大伤害、恶梦不断，生活困难，欠下巨额债务，拖欠我们工资款五年多了，现在一分钱没有拿到，希望党和政府（文山市州除外）能帮我和未得到工钱的人们讨回公道！ 举报人：李**，男，汉族，1972年3月30日生，,四川宜宾市人，住四川省宜宾市翠屏区西郊街道建新村5*号，身份证号：   5125011972******13，电话：1558722****。           2019年11月27日深夜",,,
大理洱源县以及茈碧湖镇政府征地一年未支补偿款,待回复,城建 求助,亮***,2019-11-2808:40,我父亲李**名下0.48亩国有土地及地上附作物于2018年11月3日被“征收”，至今不清楚是县政府还是镇政府行为。协商解决期间，镇政府提出，我方若需要自主选择第三方评估机构（在政府名录内的评估机构），则必须要求我方在评估前签订“保证书”认可评估结果，政府方面将按评估结果进行补偿。后来，我们写了“保证书”，评估机构也进行了评估工作并出具了评估初稿，但镇政府方面迟迟不让评估机构出具评估报告并向我方进行赔付。希望陈书记看到了帮帮我们家，早日拿到补偿款，这土地和地上附作物凝结了我父母毕生的心血啊。,,,
山海云著涉嫌无证销售恳请协助退款,待回复,城建 求助,心***,2019-11-2808:37,尊敬的陈书记，您好！本人于2018年10月份在海东山海云著项目购买了一套房号为5-1-**0的公寓，付款15万元，得知该楼盘无证销售后，我于5月31日申请退款，开发商大理轩远房地产公司以及三河泛洋公司承诺三个月内退款，经多次交涉，其间也打过12345进行投诉，开发商及中介找各种理由推脱，至今仍未收到任何款项，,,,
关于拖欠农民工劳务费快一年了一直没有解决,待回复,企业 求助,心***,2019-11-2808:33,尊敬的云南省委书记您好！马上要过春节，正在用钱的节骨眼下，我们血汗钱遥遥无期，请求领导帮忙解决，我们在云南省普洱市澜沧县富邦乡异地扶贫搬迁项目做房建和挡墙木工劳务施工，甲方是中建三局第二建设工程有限责任公司南宁分公司和云南捷烽建设工程有限公司，工程今年三月份就完工已经验收了，我们的血汗钱却遥遥无期，我们多次找甲方讨要，得到答复是，我们农民工工资已付清为由，拒绝给我们支付血汗钱，因去年七月进场，施工期间停工、窝工大，我们实际是给工人停工发薪的，甲方承诺给我们做补偿，于今年三月结算的时候，就把我们误工、窝工故意开成误工、窝工、车船使用费、材料结算单，实际我们劳务班组纯属于劳务费和损失补偿，没有卖材料给甲方，工钱都是综合在里面需要支付给工人的，甲方当时也承诺并写到结算单上最迟今年5月15日全部结清，后面我们多次讨要无果，甲方故以材料费拒接给我们支付，我们向本地劳动监察大队反应上述情况，没有得到实际解决，要求我们法院起诉，我们去年至今，没有一分钱收入，家庭难以维持，没有经济去开支法院费用，在这种情况下，希望得到领导支持！我代表我们农民工全家忠心谢谢您！,,,
上一个留言，已解决。,待回复,旅游 感谢,平***,2019-11-2808:11,我们通过双方的协商，整件事情已经得到了解决，中间强制消费的说法因为大家表达和理解不同中间有些误会，现在商家承认给我们退款，（后加的5888套餐，人民币5888元）然后保留我们之前订购的产品！,,,
因家中事被迫辞职，单位故意拖欠年末绩效,待回复,就业 求助,W***,2019-11-2719:22,书记您好，我在原就职单位曲靖市第一人民医院兢兢业业任职8年，为单位也做出不少贡献。话说没有功劳也有不少苦劳。2018年，喜迎小孩出生，可惜爱人在曲靖市第一人民医院生产时被手术感染，差点丧命，后续治疗结束想询问是哪一个环节出问题却得不到说法。接着家中因各种情况，小孩身体不好以及各种因素，我辞了工作，照顾小孩带以及小孩去就诊。辞职是于2018年12月31日办理。期间请过产假，以及小孩3个月的时候手术请过几天。人力资源却以我请假为理由，拖欠我年末绩效3000余元。我家小孩2018年7月出生，在出生的前半年，因为直管领导进修，同事退休，科室里大大小小事务都是我一个人硬着头皮去做，然而爱人也正是需要人照顾的时候却只能让她自己一个人挺过来。还有，工作上有一次省级检查，当时我还在住院，我都不敢请假，都是在中午晚上休息抽时间去检查治疗。我诉求也不高，爱人生产感染的事已让我身心疲惫，目前我就希望家人好好的，而现在唯一诉求就是希望单位能把我应得的3000余元年末绩效发放给我。后面我找过他们，人力资源拿着一份2019年新规定的文件，来搪塞我。希望书记重视！谢谢！,,,
请求陈书记解决昆明玉器城历史遗留问题,待回复,城建 求助,问***,2019-11-2718:50,陈书记，您好！昆明玉器城目前处于半烂尾状态，开发商资金断裂，房子没有交验，导致无法办理房产证，物业处于半脱管状态，小区呈现出一幅农村景象。请求陈书记协调解决昆明玉器城历史遗留问题，给百姓一个安居乐业的居住环境。,,,
房屋被拆，申请易地搬迁。,待回复,三农 投诉,W***,2019-11-2718:43,"尊敬的领导你好！我是昭通市盐津县中和乡中堡村大坪四社的村民朱**，属于低保户家庭。我有以下两个问题需要向领导反映:1.当地政府没有作出任何房屋拆除的通知，于2019年10月份把我家的房子拆除，我去找当地政府的人问我家房屋被拆了该怎么办，他们说拆了就拆了，也没对我家进行任何补偿，到现在为止我家已没房屋居住。不止是我家是这种情况，盐津县有上百家的家庭都是这样，群众去找当地政府处理，当地政府也没做任何处理。2.按照国家的政策，我家属于低保家庭，是可以纳入易地扶贫搬迁对象的，但是不知道什么原因我家没有被纳入易地扶贫搬迁对象，反而是有些家庭条件比我家还好的家庭被纳入易地扶贫搬迁对象。
以上两个问题希望领导能核实并帮助我们老百姓解决此问题，谢谢！",,,
昆明经开二小什么时候能重建？,待回复,教育 求助,留***,2019-11-2718:41,陈书记：您好！经开二小自2018年被定为c类不安全校舍拆除，计划在原址重建，但到现在一点重建的迹象都没有，学生们在临时过渡板房上课，条件艰苦，安全隐患多。询问了经开区教育局，相关工作人员给予的回复是因为与航天公司的征地价格出现了分歧，航天公司不给地，导致学校无法重建。能否请求省领导帮助协调，让孩子们早日在温馨、安全的新学校上课，谢谢！,,,
请求解决职称问题,待回复,教育 求助,李***,2019-11-2716:59,我是大理州祥云县祥城镇下村小学的老师，根据中央政策，今年9月可以晋升小学高级教师，在9月参加了填表，10月县教育局评审通过，交州评审，在11月21日，省公示的名单中没有我的名字，我也不知道是什么原因评审没有通过，人生没有几个34.尤其女教师没有几个54。即使我的资料填错了，可以给我一次机会改过，政策都对老教师放宽政策，评审员还为什么把老教师跟年轻人一起对待呢？还一刀切，我就是期中一个，在1千多人中，我就是相当于是弱势群体了，也就相当于“建档立卡贫困户”，怎么还一刀切呢？我本人请求领导督促重新评审，给我改正的机会，解决职称问题为谢！,,,
不买保险不签合同恶意克扣农名工工资,待回复,就业 投诉,来***,2019-11-2716:59,"尊敬的领导：     您好！    我妈妈在二街工业园区云天化（835项目）帮一个外包老板打工外包老板不仅不签合同，还不帮她们买保险，每个月30天基本都会上30~40个班（每个班8小时制）严重的影响了休息。我妈妈因上班期间受伤，受伤之后无人送医院，好在不是很严重自己能去医院，去了医院医生让住院，之后说要到昆明进行手术，万般无奈之下，家人找到老板老板不情愿的说先把自己的一万块钱拿出来垫付。（接上面的）由于我妈妈身体虚弱，对止疼针有过敏反应，所以医生建议保守治疗。回来之后他们老板就费尽心思要剩余的钱，还恶意克扣了我妈妈两个月辛辛苦苦挣的工资（备注：她们工资压两个月，并且每个月发现金），希望领导能管制一下，避免更多无辜的人受害。谢谢！

",,,
入住小区十年了，一直办不了产权证。,待回复,城建 求助,W***,2019-11-2716:17,书记:您好！我是云南省昆明市官渡区的业主，我们小区有3千多户，买房时开发商五证齐全，我们所有的契税等都交清了入住十年了一直没有办下房产证。求领导在白忙中帮帮我们小区谢谢！,,,
