云南翡翠价格虚高 要求退货,待回复,旅游 求助,R***,2019-11-2514:02,尊敬的陈书记 您好 今年暑假带着亲人来到向往已久的云南旅游 因为是跟团 所以路途有安排购物 在抵达购物点以前 一路导游一直给我们分享关于翡翠的知识和风水相关的内容 不得不承认种草功夫相当之深 因为他反复说云南的翡翠最真最天然 说我们去的店也是百年老店 属于旅游局统一管理的 保证货真价实 还称翡翠会每年10%多的增值，比我们家乡商场同等商品价格至少便宜30%之类的话～出于对导游的信任和他工作的支持 我买了两只翡翠手镯 分别约是5千元和四千元 一只黄龙玉手镯还有个翡翠貔貅花了2万八～入手后满心欢喜 因为一致被当地的导游们说货很好很美 买的很值（现在想来 导游们都形成了统一战线）带回来后也一直当宝贝被珍藏和爱惜 因为对于工薪阶层的我来说 这算是很贵很难得饰件 可是 最近我把东西拿出来给业内朋友看时 朋友说貔貅的吊坠最多也就值2000元 手镯值几百元而已！！顿感失落失望 感觉自己的善良被导游和商家愚弄 可以接受合理的利润销售 但不能这样愚弄消费者 这样我都不敢介绍朋友去云南旅游了！还请您明察整顿云南旅游购物的风气 ！只有貔貅还在手上 其他的已送人 我想退货处理 还望您能给予协助 不甚感激！,,,
手机号被反诈骗中心停机,待回复,旅游 求助,长***,2019-11-2513:14,你好，陈书记，之前我去云南旅游，回来手机卡就被停机了，给移动公司打电话说要给云南省反诈骗中心打电话。可怎么也联系不上，希望陈书记帮帮我。,,,
因去云南旅游，手机号被关停，求解封！,待回复,治安 求助,暴***,2019-11-2513:14,领导您好，我于11月中旬去云南旅游，11月21日发现我的北京移动手机号被停机了。中国移动客服说我的手机号是被云南反诈骗相关部门关停的，并给了我0871-63054xxx这个座机号，让我联系该部门解决。但我打了十几个电话，均无人接听。22日我通过12345热线反馈，工作人员给了我0871-63054xxx这个座机，但也是一直打不通。我现在真的是不知向谁求助了，故只能在网上留言。这个手机号是实名制的，我使用了9年多了。我现在已经回到北京。手机号关停，给我的工作、生活带来了极大的困扰。烦请领导协调公安部门尽快核实。亟待您的回复，感谢！！,,,
宜良县乡鸭湖观澜苑小区交房四年迟迟不办证,待回复,城建 求助,传***,2019-11-2510:07,尊敬的陈书记：您好！      我是昆明市宜良县乡鸭湖观澜苑二组团业主，于2016年2月向开发商昆明天城屋业有限公司按揭购入商品房1套，随即于2016年4月向物管中心办理接房手续并缴纳了相应费用及开发商代收的契税和房屋维修基金等税费，如今已经过去近4年仍未办理下不动产证。      本人曾于今年5月份求助昆明12345市长信箱希望政府机关给予帮助，得到的回复却是宜良县政务大厅一位工作人员含糊不清模棱两可的解释，根本没有解决任何实质性问题。6月份开发商工作人员告知房子已经办理网签，不可更名。本人现急需处理该套房产到外省工作，现在该套房子既不可以更名又没有不动产证，给本人生活和工作带来了极大的不便。请问开发商不动产证相关资料手续现已经办理到什么程度？是否遇到什么困难？政府将如何解决困难？是否可以明确交证时间公示予全体业主。请领导回复，不胜感激！        此致敬礼！,,,
异地拆迁,待回复,城建 求助,W***,2019-11-2509:23,我是昭阳区田坝乡二坪村民，我们享受国家异地搬迁，村上故意错报减少一人，也未提供减少文件及依据，多次找到职能部门及区、市易迁局，都叫去找村上，希望领导能看到我们的留言，万分感谢国家政策、及各位领导，相信正义一定散落到村民的各个领域,,,
农村合作医疗为什么我们地方每个人收费贵20多,待回复,医疗 投诉,W***,2019-11-2509:19,尊敬的领导，你好！         就是我咨询了我们云南相关部门对于这个农村合作医疗的收费情况，是每个人按照250元收费，可是为什么我们云南宣威市双龙街道左所村委会上左所村是按照每个人270多收费呢？这是不是说每个地方的收费情况不一样，还是他们的收费有违规的情况呢？                         谢谢！还有就是我们云南省宣威市凤凰街道凤凰山这个地方有很多厂，每天都排放很多黑烟，我感觉到这已经严重的造成了环境污染，而且危害到了我们的健康，我觉得是不是应该调查一下看看他们排放是否合理，也让我们好安心生活？,,,
手机无故被反诈骗中心停机,待回复,治安 求助,洪***,2019-11-2509:12,手机无故被云南反诈中心停机。也联系不到任何部门。也处理不了。临沧，西双版纳，思茅，德宏反诈中心电话，都是打不通。诉说无门，手机停机，支付宝，微信，银行卡，信用卡都处理不了。申明我是去了云南旅游五天  没做过任何犯法事情,,,
瑞丽出差，手机被停用。,待回复,治安 求助,l***,2019-11-2509:12,书记您好：我司领导于11月13日-20出差瑞丽，参加论坛活动，手机号码被停用，通过上海移动公司获悉云南省公安电话0871-63054338，但多次拨打无人接听。现不知该如何联系相关部门或电话解决此事，烦请书记百忙之中安排解决，不胜感激。,,,
云南腾俊物流因建设资金断链工程现己停工状态,待回复,金融 求助,W***,2019-11-2509:08,云南腾俊物流国际陆港冷链项目，因甲方资金断链导致工程进入停工状态，农民工工资问题多次找当地政府及甲方和承包方建投十五公司协商处理无果，上述责任方互相推责，上千名农民工讨薪无门，望能得到领导的帮助，春节前解决好工资问题回家过个团圆年！,,,
富源县政府拖欠教师工资,待回复,就业 投诉,A***,2019-11-2509:04,1、2017年7月云南调整工资，教师每月调整1500元，富源县政府对调整教师工资发了七月和八月，2017年9月至2018年12月的每月1500元至今没有发放，2019年1月以后按月已经发放。2、拖欠教师2018年一次性奖金，至今没有发放。3、拖欠教师乡镇岗位补贴每月500元，2018年至今没有发放。4、住房公积金没有按时到账，拖欠6个月以上，导致教师不能用住房公积金贷款，银行贷款利息高。物价上涨，二个孩子的扶养，赡养老人开支，房贷等开支大，经济压力太大，请省政府财政帮助处理。,,,
农村道路被破坏、无人管理,待回复,交通 投诉,L***,2019-11-2509:03,省委书记您好，我们是昆明市宜良县匡远镇山后村委会班猫箐、小石凹村的村民。感谢各级政府的努力付出2017年村里到县城边的唯一一条农村公路得到了硬化，道路变得宽敞、平坦。而就在道路修好不久，村里的附近的山上出现了3个采石场（宝霸采石场、泰华采石场），每天到山上拉运石头的大车严重超载对刚修好的道路造成了严重的破坏，加之之前的施工质量管控不到位，现在道路已被破坏到处坑洼不平，对村民的出行造成了严重的影响。恳请省委书记对此事高度重视，督促相关部门对我们出村的道路要求相关责任单位进行修复，给我们村民有一个良好的出行条件。在全国各地打赢脱贫攻坚这场硬仗的同时，还我们村民一条平坦而有宽阔的致富路，实现我们山后村委会各村村民与全国一道实现早日脱贫、共奔小康。,,,
关于殡葬公墓的问题,待回复,三农 建言,W***,2019-11-2508:47,尊敬的领导，你好！        我是云南省宣威市双龙街道左所村委会的一位市民。关于殡葬改革问题，虽然很多村民都还在不能完全接受和理解政策，但也都实行了火化，可是对于公墓的问题却有点头疼，公墓点在一个交通不方便，而且不利于祭祀扫墓的地方，这个地方叫东山寺的山上，每年一到祭祀扫墓的时候，就基本交通瘫痪了，车开不上去，步行又太远，我建议是不是为了方便大众祭祀扫墓，可以就近选择修建公墓，这样不但方便了公众，也便于国家关于殡葬改革政策的更好实施            谢谢,,,
我们村的乡村道路为什么一直不硬化,待回复,三农 建言,y***,2019-11-2508:47,我们村位于云南省宣威市海岱镇腊谷村委会姬郞徳村叶家坪子，在册户数80多户，人口200多户，属于扶贫示范点，挂靠在昆钢，没有硬化的道路大概有3公里左右，实在太难走啦，坑坑洼洼，开轿车的话发动机护板响个不停，另外扶贫工作种的刺梨请书记大人亲自去看看，还有扶贫工作，如果你实在忙派人到我们村去看看，扶贫是真扶贫还是做表面工作。以下附道路图片,,,
感谢领导干预，为我恢复手机,已办理,治安 感谢,1***,2019-11-2508:44,陈书记，您好！作为上海游客，我在10月23号入境景洪，手机就被停机了。24号送完资料给景洪反诈中心后，我也一直联系警方，包括直接去过昆明公安厅，直到11月9号回到上海，任然无法解除。警方公布的电话，始终无人接听。实在无奈，11月21号我只好麻烦陈书记了。给陈书记留言的一天后，就接到云南省公安厅的电话，核实后2天，就恢复了手机号。我很高兴，和我的亲戚朋友们分享了我的快乐。非常感谢陈书记，为了黎民百姓这样的小事，还要你来操心，非常感动。,云南省公安厅,网民同志：您好！    您通过人民网地方领导留言板给陈豪书记的留言收悉，云南省公安厅高度重视，感谢您对我们工作的信任理解与肯定。    祝身体健康、生活愉快！,回复时间：2019-11-26 15:50
 关于办理预售许可证的求助,待回复,城建 求助,W***,2019-11-2508:37,       大理福门置业有限公司投资建设的大理福门国际健康中心项目已交付全部土地使用权出让金，于以下日期取得相关证件：    2017年11月21日取得国有土地使用证 ，2018年02月12日取得建设用地规划许可证，2018年04月24日取得建设工程规划许可证 ，2018年04月27日取得建筑工程施工许可证 ；      同时，按提供预售的商品房计算，投入开发建设规模和资金已经远超规定的25%以上，并已经确定施工进度和竣工交付日期。       大理福门置业有限公司于2018年12月份向大理市住房和城乡建设局提交了申请办理商品房预售许可证全部申请材料，大理市住建局也回复收到相关申请材料；但截止至今11个多月过去了，一直未向我公司下发《商品房预售许可证》，现如今企业经营陷入极大困境，群众和企业的合法权益受到极大影响，预售证迟迟不能办理，严重影响了1000多名建筑工人和企业员工的就业问题，我公司的企业运营成本增加1亿多，严重影响了1000多个家庭的基本生活。    有法可依，有法必依，根据《中华人民共和国城市房地产管理法》等法律法规，我公司投资建设的大理福门国际健康中心项目完全符合颁发商品房预售许可证的条件。况且，我公司也已经完全按照大理市住建局的要求，于2019年1月提交了完整的申请办理商品房预售许可证的申请材料，大理市住房和城乡建设局应按照程序尽快办理并向我公司发放《商品房预售许可证》。    不忘初心、牢记使命，坚决拥护执行总书记的讲话精神，不断查缺补漏，以人民利益为中心，增强使命担当，照章办事，快捷高效办事，不断为人民服务，不断优化营商环境，坚决落实中央关于做好“六稳”工作的决议，坚决稳定和扩大就业，拯救企业。恳请政府部门充分考虑到我公司现阶段经营困难，予以尽快办理为谢！,,,
手机实名登记封号,待回复,治安 求助,g***,2019-11-2508:26,尊敬的领导:本人前段时间来云南周边考察市场想做点生意，不料实名登记手机无故封号，联系很多部门求助，移动和联通给了一个当地反诈骗中心联系方式96110，打了好几天一直无法接通，本人诉说无门，只能通过网络平台向领导反映情况，因为本人手机和支付宝，微信，信用卡，银行卡认证都是一体绑定，封号给我带来了严重的生活不便和生意上合作伙伴的联系，手机号都是在上海营业厅实名登记注册，期间没有发过违规信息和任何骚扰电话，望领导核实解封为盼，万分感激！,,,
手机被反诈中心无故停机,待回复,治安 咨询,W***,2019-11-2508:26,"到云南旅游了一段时间，10月21号 左右手机突然停机，停机手机为159xxxx1709，拨打中国移动的客服电话说是被云南反诈中心停机了，我没有收到任何提醒和短信确认，直接停机，我查看了这段时间与云南的联系电话只有几个来往短信不足10条，都是与云南刑侦大队发的解封qq短信，实在不能理解为何会成为诈骗电话,本人号码已经使用7年以上,实在找不到解决途径，已经被停机快1个月了，实在太影响正常生活了，因为申诉无门，希望这里能够帮助我，云南是个很好的地方，可是无故封停社交软件和手机是不是有点不妥，希望有所反馈。",,,
金马街道石油小区三供一业改造供水不作为,待回复,城建 投诉,M***,2019-11-2507:53,书记你好！我是昆明市官渡区金马街道石油小区油储公司宿舍的住户，我们小区原来使用的是小区自供水（抽水至楼顶水塔使用）。后来政府出了三供一业改造供水供电，自来水公司下属的施工单位于10月25日进入供水改造，改造后一直没有水，施工单位告知我们是因为加压泵没有启用，可是他们却一直没有施工人员在现场施工。造成了我们生活用水的很大问题，如今我们电话联系他们联系不上，施工单位还把我们小区人员拉入黑名单。没人来施工作业！上个周和他们联系，他们说他们给供电局提交了资料，供电局没有给泵房装电表，我们业主自发联系供电局给泵房装了电表，可是至今施工单位一直没有给我们小区供上水。我们联系了很多单位一直没有解决这个问题！,,,
手机号码无故被云南省公安停机,待回复,旅游 求助,l***,2019-11-2507:47,本人于18号到腾冲旅游，到今天下午4点左右在驼峰机场要离开时发现手机号码停机，后联系我的号码归属地山西移动，（手机号己用21年）告诉我打087163054338一直打不通很急，也不知找谁很无奈，给我的下一段行程造成不方便，现在支付功能及通讯功能都无法使损失非常大。也没打过什么骚扰电话，希望能及时帮我解除停机状态。申述无门只能寄希望在这里。,,,
投诉嵩明县御景新城小区和嵩明地产开发商政府管,待回复,城建 投诉,脐***,2019-11-2319:40,书记好，本人在2013年在嵩明县御景新城小区购置一套房场，是本人的首套房，期间听说之前的开发商听说破产，后让恒大旅游接盘。已经过去6年了，房产证办理迟迟未见消息，我电话给杨林教职园政府单位，他让我现场去找恒大旅游，我和他说明因工作调动，我现在本人不在昆明，他告知那就没有办法了，我现在都不知道找谁，还请书记受累能关注下此事。,,,
请陈书记为怒江碧桂园一期业主做主,待回复,企业 投诉,峡***,2019-11-2319:37,尊敬的陈书记：桂园一期业主，有情况向您反应，期望得到您的主持公道!我们一期业主投诉碧桂园房产商:1:诱骗销售，并且隐瞒可以用公积金;2:恶意竞争，随意涨价降价，扰乱市场，损害业主利益;3:以保护个人隐私为名进行各种暗箱操作，欺诈平民百姓，扰乱市场公平。4:泸水碧桂园被批准每平方准售一万多，多次询问请问这个价格是哪个部门审批，住建局，发改委，工商管理部门相互推诿，各部门未尽责为人民服！一、住建局:只要市场营销价低于备案价，就可以自由操作。以怒江州的消费和发展水平，一万多的备案价是基于什么水平?变相保护房地产，方便他们在一万元以下随意上下拉动价格，任由老百姓利益损失。二、工商管理:没有哄抬物价，不在管辖范围。三:发改委:价格管理方面已经全部转交工商部门。三个部门都没有给我们满意的答复。请书记为我们做主，切实维护百姓利益。,,,
云南腾冲买翡翠被骗,待回复,旅游 投诉,北***,2019-11-2319:32,陈书记您好！ 我和母亲于2018年6月报名旅游团-“云南芒市、瑞丽、腾冲游”，一路上导游给我们介绍云南腾冲的翡翠是原产地，价格实惠，升值空间大。还说云南政府通过补贴费用给游客，是希望各位游客通过购物来带动云南的经济，并且讲了云南的孩子上学多困难等等，要我们都支持当地建设多来云南旅游多购物。在导游带进的翡翠店里，母亲购买了一个翡翠吊坠和手镯，合计39400元。结果今年我母亲带着去菜百的时候，被鉴定人员告知价格虚高，根本不值那么多钱，起码多收了一个零。手镯的种水非常不好，全是棉，也就值几千元。我们才发现被导游骗了，云南缅都珠宝店以次充好，欺诈消费者。但是事情已经过去一年了，我们走投无路，不知该如何申诉自己的权益。母亲岁数大了，省吃俭用一辈子，本想买点国宝翡翠可以传给孩子以后留个念想，结果现在被这个事情闹得寝食难安。希望领导可以看见我们普通老百姓的诉求，帮我们联系商家办理退货，还我们一个公道，非常感谢！,,,
恳求领导为民做主,待回复,城建 求助,W***,2019-11-2319:26,本人于2017年中旬购买了北市区银河片区新时代广场住宅两套，2018年开发商通知延期交房 直至今日此楼盘尚未复工 业主多次反应投诉均无效 开发商面临破产风险 老百姓辛苦一辈子的血汗钱血本无归。开发商态度蛮横老百姓痛不欲生。望领导重点关注 为民做主！,,,
我就想知道有没有能说理的地方？,待回复,三农 咨询,W***,2019-11-2319:11,地址：云南省昭通市威信县扎西镇院子村我们那地方还算平，可以勉强能机器化，但也没多少地，大部分都是老的在家中点菜吃，几百块钱真的不够买菜吃。所谓的老板来租地，一亩600元，租期10年，现在年初就开始的，现在开始威逼利诱了。手段大体就是强挖，人家种上土豆，没有同意都给人家挖了我想知道这种事，找谁说理去？,,,
农民要血汗钱,待回复,城建 求助,力***,2019-11-2318:38,我是来自云南昭通的农民工于2019年5月份至11月份期间，在楚雄彝族自治州武定县西和安置点移民工程建设做工，至今我们打电给老板一个推一个，我们联饭没得也着，至今差我们130758元费没拿到，我们丟下老小不辞千里出来务工就想过的好一点，没想到苦了确拿不到工钱,,,
石安公路改扩建导致我家房屋严重破损,待回复,政务 求助,龙***,2019-11-2318:38,尊敬的陈豪书记：                       您好！          2019年11月7日， 昆明顺煌房屋有限公司在拆迁我家前面房屋时，由于违规操作，导致我家房屋严重受损，索幸当时并无造成人员伤亡。该公司的违法行为影响了我们的正常生活。事发后经父母多处奔波于2019年11月15日在太平新城街道办事处与该公司达成一致协议。破损房屋由该公司负责修复，并赔偿房租损失3万元。协议达成后，该公司除了安排工人简单修复倒塌房屋外，后续赔偿闭口不提。2019年11月21日经太平新城街道办事处司法所调解，该公司认为我方赔偿要求过高，须重新请第三方评估公司来进行评估。对于此种行径，我表示严重的抗议。第一次该公司请评估公司来评估，同意赔偿3万元修复房屋，而后百般抵赖。现在又要求让评估公司来评估，那么如此周而复始，评估协商达成协议然后反悔。然后再协商请评估公司来评估协商达成协议再反悔。问题何时能够解决。是否我们平民老百姓的权益除了法律就没有人能保障了？万般无奈望陈书记替我们一家解决此次问题，让我们一家重新回归正常生活！                                                                此致！,,,
丽江房地产开发市场管理乱象，亟待进行整治。,待回复,城建 投诉,y***,2019-11-2318:33,书记好：云南丽江，全国文明旅游城市，近几年房地产开发搞得风风火火，但发展的同时也曝露出一些房地产公司开发乱象，如丽江幸福里项目开发存在多项违规：一、违规审报别墅项目，国家早就明令禁止审批别墅项目，当地规划主管部门还在大量审批别墅项用地。二、顶楼送露台的形式，捆绑销售，欺骗购房消费者，导致今后业主入住后违建成风，一二期就已经存在这种情况。四、随意更改外墙立面风格，增加使用面积，特别是别墅项目，增加二层阳台，完全更改户型面积，试问当地规划部门、园林主管部门如何进行验收，针对丽江幸福里小区开发乱象，请求当地主管部门出重拳整治，还丽江房地产市场一片净土，实实在在为老百姓解决好民生住房问题。,,,
工人做工的血汗钱拿不到,待回复,城建 投诉,l***,2019-11-2318:04,我是一个民工，今年4月份在云南省昆明市五华区陈家营路与金川路交叉口向西300米新希望白鹿城工地务工。当时叫我们去做活的老板说是每个月工资的百分之七十。后去做了说是那生活费，又说我们工作做完后一起结。做了三个多月我们工作完工了。老板说不怕等几天就会给，到现在我们的老板直接什么都不给我们答复了。他上边是仟佰达劳务，再上面是中国建筑第八工程总包公司。我们这个班组都是一样的没有拿到钱。我们民工就靠这点血汗,,,
昆明盼达用车，拒不退还押金1000元,待回复,企业 投诉,p***,2019-11-2317:59,"本人在云南省昆明市呈贡大学城使用“盼达用车”app,租用新能源汽车，使用后我在2019年8月23日提交了退还1000元押金申请，截止到今天2019年11月22日，将近三个月时间了，押金迟迟不退。期间多次电话联系官方客服，但总是以“加急处理”进行搪塞、推脱，企业这种不守信用的行为，严重侵害了本人的合法权益。在此，希望领导和相关部门能给予帮助，帮助我讨回公道，督促企业尽快退还1000元押金！",,,
关于放宽云南省乡镇公务员岗位考试录用年龄,待回复,就业 建言,W***,2019-11-2317:59,关于放宽云南乡镇公务员岗位录用年龄的建议尊敬的领导：        你好！此次留言的目的是：建议放宽云南乡镇岗位公务员录用年龄致40岁。理由如下：        一、延迟退休已成定局。即使现在40的人群进入公务员队伍，他们退休时是65岁，总的工作年限与35岁进入公务员队伍相同。        二、云南乡镇多地处偏远，交通不便，条件艰苦。婚姻、家庭等许多因素导致年轻人只把乡镇岗位作为职业生涯的“跳板”，不安于现状，想千方百计向上“爬”，追求更好的生活环境这并没有错，但客观上造成了基层公务员队伍的不稳定。35——40岁的这部分人多已成家，能全心全意扎根基层服务基层。        三、黑龙江、广西等省份已放宽乡镇岗位年龄至40岁，我省与黑龙江、广西省情十分相似，所以我省也应尝试放宽乡镇岗位考录年龄。        四、有人认为：考公年龄限制是考虑到用人成本和人才成长规律。表面看似乎有道理，实则经不起推敲。35——40岁虽已过了组织提拔的年龄，但许多公务员至退休也只是普通的科员，很难简单判断他们是否成才。         “大木百寻，根积深也：沧海万仞，众流归也”。国家长治久安需要稳定的基层公务员队伍。恳求领导研究“关于放宽云南乡镇公务岗位录用年龄的建议”的可行性，选拔出更适合云南乡镇岗位的人才。       此致敬礼！,,,
