违法楼顶户外广告依法予以拆除,待回复,城建 投诉,y***,2018-11-2409:45, 长宁区委书记王为人，你好：      反映长宁区新泾镇剑何路429号楼顶有多处违法户外广告，该处大型户外广告设置年限已久，四周都是交通要道和居民区，大风一刮非常的危险，市民对这个巨大的公共安全隐患防不胜防。存在严重的安全隐患。希望长宁区政府根据本市户外广告专项整治方案要求，对影响城市形象的该处违法楼顶户外广告依法予以拆除，保障行人的安全，切实提升长宁区城区形象。,,,
整治违规破墙开门行为,待回复,城建 投诉,y***,2018-11-0707:55,长宁区委书记王为人，你好：    反映长宁区程家桥街道程桥二村1号外面门卫室违规破墙开门，擅自改变房屋使用性质，不仅破坏了房屋结构，造成安全隐患，还影响周围环境。希望长宁区程家桥街道执法部门在国际博览会前，按照“五违四必“精神，对影响城市形象的这处违规破墙开门，擅自改变房屋使用性质违章建筑在进博会前依法予以拆整治，依法砌墙“封门”，恢复房屋原状，让城市市容秩序更加规范，城市环境更加整齐，切实提升长宁区城区形象。,,,
违规破墙开门，擅自改变房屋使用性质,待回复,城建 投诉,y***,2018-09-3022:46,长宁区委书记王为人，你好：   反映长宁区程家桥街道程桥二村1号外面门卫室违规破墙开门，擅自改变房屋使用性质，不仅破坏了房屋结构，造成安全隐患，还影响周围环境。希望长宁区有关部门在国际博览会前，按照“五违四必“精神，对影响城市形象的这处违规破墙开门，擅自改变房屋使用性质违章建筑在进博会前依法予以拆整治，依法砌墙“封门”，恢复房屋原状，让城市市容秩序更加规范，城市环境更加整齐，切实提升长宁区城区形象。,,,
虹古路临时疏导点，存在安全隐患,待回复,城建 投诉,y***,2018-09-1115:49,长宁区委书记王为人，你好：     长宁区虹古路355弄虹古路临时疏导点，存在严重安全隐患，也严重地影响了即将在上海举办国际博览会周边城市的形象。一旦临时疏导点发生火灾事故，后果严重。希望长宁区有关部门尽快拆除这存在消防安全隐患虹古路临时疏导点。 ​​​​,,,
依法拆除违法建筑——玻璃房,待回复,城建 投诉,y***,2018-08-2410:25, 长宁区委书记王为人，你好：      反映长宁区程家桥街道虹桥路2258号上海优秀历史建筑——孔家花园门后面，有多处违法建筑——玻璃房。这多处违法建筑——玻璃房不但地影响市容市貌，而且还给上海优秀历史建筑带来了安全隐患，破坏了优秀历史建筑承受能力。    该建筑原为孔祥熙旧居，是中国“四大家族”之一的孔祥熙在上海的度假别墅，建筑建于1934年，于2005年10月31日被上海市人民政府列入“优秀历史建筑”令人心痛的是，这私搭乱建的违法建筑——玻璃房，把原有建筑变了个样。“有关部门到底想不想拆违？优秀历史建筑再不保护就晚了。”    希望长宁区政府有关执法部门按时“五违四必”精神，尽快依法在国际博览会前拆除这一影响城市形象的违法建筑——玻璃房。,,,
楼顶户外广告存在安全隐患,待回复,城建 投诉,y***,2018-08-1008:23, 长宁区委书记王为人，你好：      长宁区剑何路429号楼顶有多处违法户外广告（如：如家酒店、布丁酒店连锁、火龙果KTV），该大楼几处大型户外广告设置年限已久，且未及时有效维护，该大楼上安装着大广告牌，四周都是交通要道和居民区，大风一刮非常的危险，存在严重的安全隐患。      该楼顶有多处违法户外广告（如：如家酒店、布丁酒店连锁、火龙果KTV），这违法户外广告严重地影响城市的形象。为何新泾镇拆违办面对市民多投诉而不拆除呢？长宁区政府应进入调查，对新泾镇拆违办行政不作为行为予以问责！            希望长宁区政府根据本市户外广告专项整治方案要求，有关部门要尽快将其纳入拆除计划，在国际博览会前，对影响城市形象该楼顶多处违法户外广告依法予以拆除，保障行人安全。,,,
沿虹桥路景观马路有一老洋房上有违章建筑,待回复,城建 投诉,y***,2018-07-2916:13,长宁区委书记王为人，你好：     反映长宁区虹桥街道虹桥路1702号老洋房二楼，有一住户违章塑钢门窗建筑，严重地影响虹桥路城市窗口形象。国际博览会即将在上海举办，希望虹桥街道有关部门依法拆除这一违章建筑。     请问： ​​​​这沿虹桥路景观主干道旁的塑钢门窗违章建筑为何拆不了……？,,,
拆除存在安全隐患违法户外广告,待回复,城建 投诉,y***,2018-07-2216:43,长宁区委书记王为人，你好：     反映长宁区剑何路429号楼顶有多处违法户外广告（如：如家酒店、布丁酒店连锁、火龙果KTV），该大楼几处大型户外广告设置年限已久，且未及时有效维护，这楼顶多处违法户外广告存在严重的安全隐患。上海已发出强台风黄色预警，加之暴雨将近，整治拆除工作刻不容缓。希望长宁区政府尽快在国际博览会前，对影响城市形象该楼顶多处违法户外广告依法予以拆除，切实做好强降雨期间户外广告安全防御工作。,,,
拆除影响市容市貌的违章小房子,待回复,城建 投诉,y***,2018-07-1011:28," 长宁区委书记王为人，你好：     长宁区剑何路423号有一个无证违法建筑小房子，这违法建筑小房子严重地影响城市的形象。     【长宁区网格中心】答复如下：新泾镇拆违办于经了解，来电人反映的属于公建配套设施，未列入拆除计划。违法建筑说成是“公建配套设施”，典型的行政不作为。   国际博览会即将在上海举办，  希望有关部门按照“五违四必“精神，对这处违章建筑依法予以拆除,让城市市容秩序更加规范，城市环境更加整齐。 ​​​​",,,
拆除违规户外广告招牌,待回复,城建 投诉,y***,2018-07-0316:49,  长宁区委书记王为人，你好：    反映上海长宁区西郊百联购物中心（仙霞西路88号）楼顶有多处违法户外广告，这楼顶有多处违法户外广告存在严重的安全隐患，影响城市的形象。希望长宁区政府尽快在国际博览会前依法拆除这楼顶有多处违法户外广告。,,,
上街沿被圈成停车场－－违规,待回复,交通 投诉,y***,2018-07-0208:01,长宁区委书记王为人，你好： 反映长宁区虹桥路1488号旁的上街沿被圈成停车场 有的车主把车停留在人行道盲道上，​​​​给市民出行造成了不便。听说此上街沿经区什么部门批准作为收费停车场。人行道无疑是留给行人的，机动车停放在人行道上是不允许的，对此，《中华人民共和国道路交通安全法》上有明确的规定：   1，《中华人民共和国道路交通安全法》第五十六条明确规定：机动车应当在规定地点停放。禁止在人行道上停放机动车。2，《中华人民共和国道路交通安全法》 第九十三条 对违反道路交通安全法律、法规关于机动车停放、临时停车规定的，可以指出违法行为，并予以口头警告，令其立即驶离。机动车驾驶人不在现场或者虽在现场但拒绝立即驶离，妨碍其他车辆、行人通行的，处二十元以上二百元以下罚款，并可以将该机动车拖移至不妨碍交通的地点或者公安机关交通管理部门指定的地点停放。请问？谁给的权同意在上街沿上违规设置停车场的？国家博览会即将在上海举办，希望长宁区整治人行道乱违规停车现象，把公共道路让出来，还路于民。,,,
上街沿被圈成停车场 ——违规,待回复,城建 投诉,y***,2018-06-2312:46,长宁区委书记王为人，你好：     长宁区虹桥路1488号旁的上街沿被圈成停车场 有的车主把车停留在人行道盲道上，​​​​给市民出行造成了不便。听说此上街沿经区什么部门批准作为收费停车场。人行道无疑是留给行人的，请问？谁给的权同意在上街沿上违规设置停车场的？几年前由于市民也反映过此问题，后来区交警部门整治过，但现此问题又回潮了。国家博览会即将在上海举办，希望长宁区政府整治人行道乱违规停车现象，把公共道路让出来，还路于民。,,,
尽快拆除弄内两处违章搭建,待回复,城建 投诉,y***,2018-06-1310:51, 长宁区委书记王为人，你好：    长宁区延安西路949弄5号美宇宾馆门口未经授权两处违规搭建，一处是玻璃顶门禁，另一处是到底一间砖结构的小房子。希望长宁区政府按照《实施》精神，以“五违四必”治理工作为重点，尽快依法拆除这一存在着严重的安全隐患、影响城市形象的违法建筑。,,,
沿街楼面上有多处违章  影响城市形象,待回复,城建 建言,y***,2018-06-0507:39,长宁区委书记王为人，你好：  反映长宁区延安西路999号这幢楼面上存在几个违建问题：一是楼顶上有破旧的广告栏，二是楼边沿有违章建筑。国际博览会即将在上海举办，立面环境是一座城市形象的重要展示窗口，体现着城市的品位和形象，这违规设置的广告牌不仅影响了市容美观，更存在一定的安全隐患。今年国际博览会顺利在上海举办，希望有关部门进一步加大对长宁沿街城市容环境集中整治工作力度，对影响市容市貌的户外广告及商业秩序进行了专项集中整治，为“迎接国际博览会顺利在上海举办”提供良好的城市形。,,,
古北新区水城南路37号万科广场北4楼万岛保健,待回复,其他 投诉,W***,2018-05-2108:42,尊敬的书记你好：我是附近的一名住客，想向有关领导反应水城南路37号万科广场北4楼的万岛保健从事色情服务非常严重，严重影响当地居民日常生活，行为恶劣，后果极其严重,,,
整治破墙开门,待回复,城建 投诉,y***,2018-03-1607:38,反映长宁区淮海中路2052号右边“恒雄地产”店门面是违规破墙开门。对于市民的呼声，希望长宁区政府积极调查，新华街道执法部门必须按照《实施》精神，希望有关部门整治违规破墙开门行为，恢复原样。,,,
拆除沿街违章搭建的玻璃房,待回复,城建 投诉,y***,2018-03-0519:55,反映长宁区仙霞街道仙霞路686号左边沿街有一违章搭建的玻璃房，这明显的无审批的违章搭建的玻璃房，严重影响市容市貌也影响长宁区全国文明城市的形象。对于市民的呼声，希望长宁区政府积极调查，仙霞街道执法部门必须按照《实施》精神，尽快依法拆除这影响城市景观的“存量违建”——玻璃房。,,,
希望拆除违章搭建的玻璃房,待回复,城建 投诉,y***,2018-02-2619:11,反映长宁区仙霞路686号左边沿街门面房有一违章搭建的玻璃房，这明显的无审批的违章搭建的玻璃房，严重影响市容市貌，也影响长宁区全国文明城市的形象，希望相关部门尽快依法拆除这一违建。 ,,,
小区业主私装地锁 私自霸占公共停车位,待回复,城建 投诉,y***,2018-02-0521:37,      反映长宁区程家桥街道虹井路八八八弄嘉丽豪园小区7号旁的停车位上，有住户私家车主竟将这临时车位安装了地锁，据为私家车位。已划的车位，是所有车主共享的车位，并不是个人单独用的，私装地锁是不可以的。住户私装地锁，侵占公共停车位，物业对此不作为。   【长宁区网格中心】回复12345热线：“您好，您编号为WZ20180201388314的事项已经办理完毕，现将办理意见答复如下：在豪园小区议事规则，业主公约里无不可安装地锁条例，豪园居民区室私人小区，此车位是固定车位，举报者非小区业主，也不是小区居民，对小区实际情况不了解。而且经现场查看此处也没有地桩锁，附件照片。。”    对【长宁区网格中心】的回复不满意，要对不负责人的回复人进行问责。    程桥城管中队1月25日接投诉后联系来来电人告知其问题已经在处理中，中队队员致电投诉人了解情况并前往该处勘察情况，有安装地锁的情况。    希望有关部门倾听百姓呼声，督促职能部门拿出及时有效的整改行动。,,,
住户私装地锁侵占公共停车位,待回复,城建 投诉,y***,2018-02-0412:52,    长宁区委书记王为人，你好：    反映长宁区程家桥街道虹井路八八八弄嘉丽豪园小区7号旁的停车位上，有住户私装地锁。小区通道上安个地锁竟成私家车位，侵占公共车位，把公共用地变成了私人停车位，给其它居民造成不便。    我2018-01-22 向12345市民热线反映后，2018-02-01【长宁区网格中心】回复：“ 您好，您编号为SJ20180122382572的事项已经办理完毕，现将办理意见答复如下：程桥城管中队25日接投诉后联系来来电人告知其问题已经在处理中，中队队员致电投诉人了解情况并前往该处勘察情况，有安装地锁的情况。后嘉利豪园居委会于2月1日上午9:30由豪园居委会李雯对来电人所反映的情况进行核实，该车位是业主固定车位，并没有把公共车位变为私人车位。所以诉求人投诉不属实，诉求过高。”  对以上【长宁区网格中心】回复不满意。   根据有关规定，任何单位和个人不得擅自在道路上和其他公共区域设置地桩、地锁等障碍物阻碍机动车停放和通行，不得在未取得所有权的停车位上设置地桩、地锁。希望有关部门整治小区私装地锁违规行为。 ,,,
顶层公共空间违章建筑予以全部拆除,待回复,城建 投诉,y***,2018-01-0715:43,  长宁区委书记王为人，你好：反映长宁区虹桥街道虹梅路3888弄延北小区1号、3号、5号、7号、9号、17号、19号等40多户小区业主在顶层公共空间均未办理任何审批手续，肆意改变楼顶的结构，在屋顶上私自搭建建筑物，有敞开式玻璃雨棚，还有全封闭式房子，改变楼顶的承重。再说，在屋顶上如此“加层”，增加了整幢房子的承重量，房屋安全性受到影响。“一旦楼顶出现险情，租户逃生都存在困难。”除了存在消防安全隐患，这些加盖的板房还会增加建筑的荷载量，出现超重、超载的情况，甚至局部损坏建筑。这顶层公共空间违章建筑为何反复投诉拆不了。　希望长宁区政府领导重视，主管领导牵头联合城管、公安、房管、街道关部门对该小区顶楼违章建筑情况做一次大检查，并加大执法力度，依法将这些违法建筑予以全部拆除。,,,
家乐福古北店屋顶上的违建房何时才能拆除？,待回复,城建 投诉,y***,2018-01-0321:43, 长宁区委书记王为人，你好：上海市长宁区水城南路268号家乐福古北店屋顶上存在顶楼违建问题。在屋顶上违建房，不但对楼体结构产生安全隐患，而且影响上海城市的市容市貌和高架桥沿线风貌。　请问长宁区虹桥街道城管，家乐福古北店屋顶上的违建房何时才能拆除？,,,
请问：这大型户外广告牌什么时候才能拆除？,待回复,城建 投诉,y***,2017-12-2008:13,长宁区虹桥路１４８８号 上海纺织疗养院房顶上有1处大型违规户外广告，随着年久固定的铁架开始锈蚀，存在安全隐患。这户外广告设施不仅破坏城市景观和街头风貌，还污染人们的视觉神经。违规广告牌不仅影响城区市容市貌，还存在极大的安全隐患。请问：这大型户外广告牌什么时候才能拆除？【上海市长宁区网格中心】反馈，经执法局认定，上海市虹桥路1488号上海纺织屋顶设施并非户外广告而是其公司招牌，至于安全问题我局已要求上海纺织方面提供安全年检报告。请问：无审批的“大型户外公司广告招牌”算不算户外广告……？对【上海市长宁区网格中心】反馈不满意！希望长宁区政府切实整改，开展排查，依法组织拆除位于上海纺织疗养院房顶上的大型户外公司广告招牌，最大限度消除该处户外广告的安全隐患，改善上海城市的市容市貌。,,,
大型违规户外广告何时才能拆,待回复,城建 投诉,y***,2017-12-0822:23,长宁区虹桥路１４８８号 上海纺织疗养院房顶上有1处大型违规户外广告，随着年久固定的铁架开始锈蚀，存在安全隐患。这户外广告设施不仅破坏城市景观和街头风貌，还污染人们的视觉神经。违规广告牌不仅影响城区市容市貌，还存在极大的安全隐患。请问：这大型户外广告牌什么时候才能拆除？希望长宁区政府切实整改，开展排查，依法组织拆除位于上海纺织疗养院房顶上的大型户外广告，最大限度消除该处户外广告的安全隐患，改善上海城市的市容市貌。 ,,,
这大型违规户外广告何时才能拆,待回复,城建 投诉,y***,2017-11-3017:07,长宁区委书记王为人 ，你好：    反映上海市长宁区虹桥路１４８８号 上海纺织疗养院房顶上有1处大型违规户外广告，随着年久固定的铁架开始锈蚀，存在安全隐患。这户外广告设施不仅破坏城市景观和街头风貌，还污染人们的视觉神经。违规广告牌不仅影响城区市容市貌，还存在极大的安全隐患。请问：这大型户外广告牌什么时候才能拆除？希望长宁区政府切实整改，开展排查，依法组织拆除位于上海纺织疗养院房顶上的大型户外广告，最大限度消除该处户外广告的安全隐患，改善上海城市的市容市貌。,,,
我买了套房子，房价上涨，房东毁约，房东一直拖,待回复,金融 求助,匿***,2017-10-1817:08,我买了套房子，房价上涨，房东毁约，房东一直拖，现在房东上诉二审，拖延时间，我无法再买房子，必须等，我希望能和房东解除购房合同。房东是律师，政府是我唯一希望。,,,
违章建筑必须拆除,待回复,城建 投诉,y***,2017-09-2410:40,反映长宁区虹桥街道虹梅路3888弄延北小区有许多户小区业主在顶层公共空间均未办理任何审批手续，肆意改变楼顶的结构，拆墙开窗，铺设地板等，改变楼顶的承重。这些违法建筑大都采用简易的建筑材料，经过风吹日晒会出现生锈、翻翘、松动等现象，大风天气还容易被刮掉，所以这些违法建筑存在很大的安全隐患。底层许多住户在天井违章搭建，也存在严重的安全隐患。      希望长宁区政府“五违四必”精神，虹桥街道要联合城管、公安、市场监督所、房管、规土、消防、市容等部门联手，对该小区的违章建筑情况做一次大检查，并加大执法力度，依法将这些违法建筑予以全部拆除。,,,
顶楼违章建筑危险,待回复,城建 投诉,y***,2017-08-2510:17,上海市长宁区虹梅路3888弄延北小区1号、3号、5号、7号、9号、17号、19号等40多户小区业主在顶层公共空间均未办理任何审批手续，肆意改变楼顶的结构，拆墙开窗，铺设地板等，改变楼顶的承重。这些违法建筑大都采用简易的建筑材料，经过风吹日晒会出现生锈、翻翘、松动等现象，大风天气还容易被刮掉，所以这些违法建筑存在很大的安全隐患。  希望长宁区城管、公安、房管、街道关部门要联合对该小区顶楼违章建筑情况做一次大检查，并加大执法力度，依法将这些违法建筑予以全部拆除。,,,
顶楼违建隐患大,待回复,城建 投诉,y***,2017-08-0916:45,反映上海市长宁区水城南路268号家乐福古北店屋顶上存在顶楼违建问题。在屋顶上违建房，不但对楼体结构产生安全隐患，而且影响上海城市的市容市貌和高架桥沿线风貌。希望长宁区政府领导引起重视，“补短板”跟踪督办，加大拆违力度，尽快拆除高架桥没线水城南路268号家乐福古北店屋顶上的违建房。,,,
人行道窄,待回复,城建 建言,y***,2017-06-0311:07,上海长宁区虹桥路虹井路996号这段马路被一个老破旧的小房子不偏不倚的竖在人行道上，人行道窄到令人不能走。行人只得从非机动车上走。这里近上海动物园，双休日、节假日人流量较多，把行人都“逼”上了慢机动车道，人车混行，这房占住人行道既妨碍路人通行，也影响市容，给行人（尤其是盲人）行走带来了安全隐患。希望相关部门协调，并把这问题纳入政府规划之中去，尽快将其早日迁走。同时，市民亟盼政府早日拓宽这段人行道。,,,
人行道太窄小了,待回复,城建 投诉,匿***,2017-04-0116:50,   长宁区虹桥路2302号旁程家桥路东南侧公交站点，925路、57路等车站车站的人行道太窄小了，该车站高峰时间候车的人流量很多，窄小的人行道给乘客候车和行人行走都带来了不便，存在着安全隐患问题。希望有关部门尽快把后面的空闲地让点出来供公交车站使用。 ​​​​ ,,,
破坏公共绿化违章搭建,待回复,城建 投诉,匿***,2017-03-2220:19,长宁区黄金城道693号旁，将一段绿化带全部破坏，被私自违章搭建无证房，开设门面房，把公共绿地当私产，随意搭建违法建筑，在无证无照的情况下却能堂而皇之，监管部门在干什么……？。违章搭建，破坏公共绿化占道经营的行为，严重地影响长宁区城区的形象，希望有关部门整治违法建筑房，按照《实施》精神，依法尽快拆除这一违建房，并恢复原来的公共绿地。,,,
破坏公共绿化违章搭建,待回复,其他 投诉,匿***,2017-03-1813:55,长宁区黄金城道693号旁，将一段绿化带全部破坏，被私自违章搭建无证房，开设门面房，把公共绿地当私产，随意搭建违法建筑，在无证无照的情况下却能堂而皇之，监管部门在干什么……？。违章搭建，破坏公共绿化占道经营的行为，严重地影响长宁区城区的形象，希望有关部门整治违法建筑房，按照《实施》精神，依法尽快拆除这一违建房，并恢复原来的公共绿地。,,,
拆迁顶层违法搭建房,待回复,城建 投诉,匿***,2016-12-3017:24,上海市长宁区虹梅路3888弄延北小区1号、3号、5号、7号、9号、17号、19号等一些小区住户在顶层公共空间违法搭建。严重地破坏了房屋结构，也存在安全隐患。希望长宁有关部门按照《实施》精神，加大住宅小区内损坏房屋承重结构违法行为的查处力度，以“五违四必”治理工作为重点，坚决依法拆除这一存在着严重的安全隐患违法建筑。,,,
天山五村不是靠改造能解决的。,待回复,城建 求助,匿***,2016-12-2515:34,书记你好。我是天山五村的居民。实在是没办法了。领导们来五村调研寻访看到的都是表面情况。我们五村已经60年的房子了。脏乱差不用说。这些表面都可以做好。我是住比较里面的居民。你们改造的也只是靠马路房子弄漂亮。我们里面的居民已经住不下去了。我想说的是内部。你们领导来内部看看过吗？房子漏水十分严重。一直都在自己家里修补弄防水。但是重新装修后没多久还是漏水。底楼白蚁都出现了。到处都是老鼠。这次的拆违顶楼。我们2.3楼家里都摇晃的。说句不好听的，你们就是用改造来敷衍我们。说为我们百姓改善居住。但事实呢。你们领导是在求不出事吗？这样的房子不能改造了。为什么就不能想办法帮我们拆迁。是要等房子塌了出事了才会重视吗？希望领导看到帮助我们百姓。五村的居民真的苦不堪言。,,,
